state_case,lease_mode,mutation_attempt,ack_state,continuity_state,same_shell_recovery_state,mutating_resume_state,reason_codes,operator_meaning
authoritative_save,foreground_mutating,accepted,saved_authoritative,stable_writable,stable,allowed,CONTINUITY_PROOF_STABLE|MUTATION_APPEND_ONLY_RECORDED,Authoritative save may render quietly because settlement and continuity both agree.
background_read_only_resume,background_read_only,none,read_only_view,stable_read_only,stable,rebind_required,NONE,Background tabs may inspect the draft without taking the mutable lane.
background_mutation_blocked,background_read_only,rejected,recovery_required,recovery_only,recovery_only,rebind_required,BACKGROUND_LEASE_MUTATION_FORBIDDEN,Background tabs may not mutate and must land in governed recovery instead of silent overwrite.
stale_version_conflict,foreground_mutating,rejected,merge_required,recovery_only,recovery_only,rebind_required,DRAFT_VERSION_CONFLICT,Conflicting writes open DraftMergePlan instead of last-write-wins.
resume_token_or_runtime_drift,foreground_mutating,rejected,recovery_required,recovery_only,recovery_only,rebind_required,SESSION_EPOCH_DRIFT|SUBJECT_BINDING_VERSION_DRIFT|MANIFEST_VERSION_DRIFT,Writable resume is suspended until the same lineage is revalidated.
promotion_superseded,foreground_mutating,rejected,recovery_required,blocked,blocked,blocked,PROMOTED_REQUEST_AVAILABLE,Promoted drafts may route only to request recovery or the mapped request shell.
