case_id,case_family,initial_state,user_action,resulting_state,shell_continuity_rule,notes
FILE_PICKER_ACCEPTED_IMAGE,selection,empty_lane,Choose files,ready / kept,stay_on_supporting_files,Standard JPEG reaches governed preview after quarantine upload and scan
DRAG_DROP_RETRYABLE_TRANSFER_FAILURE,retry,retryable transfer failure,Retry,ready / kept,stay_on_supporting_files,Retry reuses the same card and does not reset the step
MOBILE_CAMERA_CAPTURE_PREVIEW_DEFERRED,capture,empty_lane,Use camera,preview unavailable but kept,stay_on_supporting_files,HEIC capture keeps evidence while admitting no inline preview
DUPLICATE_UPLOAD_REUSES_EXISTING_CARD,duplicate,ready / kept,Choose same file again,ready / kept,focus_existing_card,No second evidence row is created when the duplicate fingerprint matches
UNSUPPORTED_TYPE_STAYS_VISIBLE,quarantine,empty_lane,Choose files,quarantined unsupported type,stay_on_supporting_files,Unsupported files remain visible with replace and remove actions
UNREADABLE_FILE_REPLACE_FLOW,replace,quarantined unreadable / integrity failure,Replace,replaced_then_ready,focus_replacement_card,The old card stays as replaced while the new card settles
MALWARE_FILE_REMOVE_FLOW,remove,quarantined malware,Remove,removed,focus_dropzone,Removing a blocked file does not reset neighboring answers or the current step anchor
PREVIEW_ACTION_USES_GOVERNED_GRANT,preview,ready / kept,Preview,ready / kept,open_same_shell_preview_panel,Preview opens through governed grant metadata rather than a raw storage URL
