source_id,source_family,source_label,visible_when,editable_here,edit_authority,verification_or_freshness,side_effect_boundary,repair_visibility
nhs-login-claim,nhs_login_claim,NHS login,always,false,external_nhs_login,current_session,Vecells preference edits do not update NHS login claims,informational
vecells-contact-preferences,vecells_preference,Vecells preferences,always,true,vecells_patient_preference,patient_reviewed,Preference edits affect Vecells communication behavior only,reviewable
pds-demographics,external_demographic,PDS,feature_gate_or_bounded_absence,false,external_pds,projected_or_feature_gated,Preference edits do not update PDS demographic rows,bounded_absence_when_off
gp-demographics,external_demographic,GP system,feature_gate_or_bounded_absence,false,external_gp_system,projected_or_unavailable,Preference edits do not update GP demographic rows,bounded_absence_when_off
reachability-contact-route-200,reachability_blocker,Callback reply reminder path,blocking_active_path,false,contact_repair_required,current_active_path,Repair does not alter NHS login/PDS/GP authority,promoted_visible_panel
