caseId,scenario,expectedBundleState,expectedSummaryVisibility,notes
VERIFIED_PARITY_AUTHORITATIVE_SUMMARY,verified_bundle_with_transcript,ready,authoritative,Verified parity keeps the deterministic summary authoritative.
STALE_PARITY_PROVISIONAL_ONLY,stale_parity_suppresses_authoritative_summary,stale_recoverable,provisional,Stale parity keeps provisional copy only and suppresses authoritative regenerated text.
BLOCKED_PARITY_SUPPRESSES_REGENERATED_SUMMARY,blocked_parity_manual_guard,stale_recoverable,suppressed,Blocked parity removes authoritative regenerated summary text entirely.
RULES_SUGGESTION_VISIBLE_SHADOW_SILENT,verified_bundle_with_transcript,ready,authoritative,Rules suggestions remain visible while shadow_model stays silent_shadow.
TRANSCRIPT_ABSENT_PLACEHOLDER_STABLE,transcript_absent_and_large_attachments_degrade_safely,ready,authoritative,Transcript absence degrades through a typed placeholder without breaking determinism.
LARGE_ATTACHMENT_PREVIEW_UNAVAILABLE,transcript_absent_and_large_attachments_degrade_safely,ready,authoritative,Large attachments can fall back to preview_unavailable while provenance stays intact.
