caseId,checkpointState,cycleCurrent,requestClosed,repairBlocked,replayAlreadyAssimilated,policyAllowsLateReview,expectedDisposition,notes
ACCEPTED_IN_WINDOW_OPEN,open,true,false,false,false,true,accepted_in_window,Live open checkpoint accepts the reply and unlocks canonical assimilation.
ACCEPTED_LATE_REVIEW_CURRENT,late_review,true,false,false,false,true,accepted_late_review,Late review stays legal only while the cycle remains current and closure has not settled.
BLOCKED_REPAIR_CONTACT_ROUTE,open,true,false,true,false,true,blocked_repair,Contact-route or release repair blocks live assimilation and preserves recovery context only.
SUPERSEDED_DUPLICATE_REPLAY,superseded,false,false,false,true,true,superseded_duplicate,Older-cycle or replayed replies collapse into one explicit superseded duplicate disposition.
EXPIRED_REJECTED_CLOSED_REQUEST,expired,true,true,false,false,false,expired_rejected,Closed requests and expired checkpoints do not reopen routine flow.
