caseId,replayOrDriftClass,expectedOutcome,notes
IDEMPOTENT_REPLAY_REUSES_DISPOSITION,idempotent_replay,existing_result_returned,The same idempotency key must return the existing disposition and assimilation result.
SEMANTIC_REPLAY_REUSES_ASSIMILATION,semantic_replay,existing_result_returned,A second command with the same semantic payload may not mint a second snapshot.
DRIFT_BEFORE_COMMIT_FAILS_CLOSED,current_cycle_drift,assimilation_rejected,If supersession happens before commit the pipeline fails closed and records no response assimilation.
FOURTH_REOPEN_SUPERVISOR_REVIEW,reopen_oscillation,supervisor_review_required,The fourth reopen inside twenty-four hours suppresses automatic queue return.
CLINICIAN_RESOLUTION_RESETS_OSCILLATION_WINDOW,resolution_reset,routine_return_allowed,A clinician-resolution event resets the reopen window and prevents false supervisor holds.
