caseId,startingState,trigger,expectedState,expectationEnvelopeState,resolutionOrNote
CREATE_TO_QUEUED,created,create_callback_case,queued,queued,seed becomes first-class callback shell
SCHEDULE_WITH_ACTIVE_LEASE,queued,schedule_with_live_intent_lease,scheduled,scheduled,authoritative promise published
RESCHEDULE_REACQUIRE_AFTER_DRIFT,scheduled,material_window_or_route_drift,scheduled,scheduled,new lease tuple replaces stale one
READY_FOR_ATTEMPT_ARMED,scheduled,arm_ready_with_current_policy,ready_for_attempt,scheduled,attempt may start under the active lease
ROUTE_INVALID_TO_REPAIR,awaiting_outcome_evidence,record_route_invalid_outcome,contact_route_repair_pending,route_repair_required,stale callback promise revoked
NO_ANSWER_TO_RETRY,no_answer,settle_resolution_retry,awaiting_retry,retry_planned,retry remains explicit and non-terminal
MAX_ATTEMPTS_TO_ESCALATE,no_answer,settle_resolution_after_max_attempts,escalation_review,escalated,callback does not complete optimistically
ANSWERED_TO_COMPLETE,answered,settle_resolution_complete,completed,closed,closure waits for CallbackResolutionGate
