caseId,fromResult,toResult,legalWhen,expectedProjectionState
QUEUED_TO_PATIENT_NOTIFIED,queued,patient_notified,patient consequence sent but completion artifact not yet terminal,recovery_required
QUEUED_TO_WAITING_DEPENDENCY,queued,waiting_dependency,live dependency is dominant and current tuple remains legal,recovery_required
WAITING_TO_COMPLETED,waiting_dependency,completed,current tuple still bounded admin only and matching completion artifact plus expectation binding exist,recovery_required
ANY_TO_STALE_RECOVERABLE,queued|patient_notified|waiting_dependency|completed,stale_recoverable,presented tuple or epoch drift is detected,stale
COMPLETED_TO_REOPENED_FOR_REVIEW,completed,reopened_for_review,boundary or evidence reopens governed review,recovery_required
QUEUED_TO_BLOCKED_PENDING_SAFETY,queued,blocked_pending_safety,live blocker or repair route makes bounded admin consequence illegal,recovery_required
