edge_case,input_shape,expected_handling,implemented_outcome,notes
explicit_utc_offset,2026-04-20T09:00:00.000Z,accept_and_normalize,valid,baseline path for replayable supplier rows
explicit_positive_offset,2026-04-20T09:00:00.000+01:00,accept_and_normalize,valid,offset preserves instant across display timezone conversion
offset_free_with_timezone,2026-10-25T01:30:00 + Europe/London,reject_and_recover,temporal_ambiguous_local_time,fail-closed until a timezone-safe bridge exists
offset_free_without_timezone,2026-10-25T01:30:00,reject_and_recover,temporal_timezone_missing,no silent local-time coercion
invalid_end_before_start,start>end,reject_and_recover,temporal_invalid_timestamp,range failure increments reject counters
dst_boundary_crossing,offset-resolved row near DST change,accept_with_boundary_marker,adjacent_boundary|crosses_boundary,boundary state is persisted rather than collapsed
