drift_class,trigger_surface,expected_context_state,write_posture,required_recovery,notes
organisation_switch,presented_or_observed_active_organisation_mismatch,stale,frozen,re-read_same_case_under_new_context,backend truth may not reinterpret the shell silently
tenant_scope_change,tenant_scope_mode_or_refs_mismatch,stale,frozen,re-read_same_case_under_new_scope,scope tuple must be reissued
environment_change,environment_ref_mismatch,stale,frozen,re-read_under_current_environment,guards against sandbox_vs_live drift
policy_plane_change,policy_plane_ref_mismatch,stale,frozen,re-read_after_policy_recompile,prevents writes on stale policy-plane facts
purpose_of_use_change,presented_purpose_differs_from_current_context,stale,frozen,reissue_context_for_new_purpose,purpose may not be inferred from navigation
elevation_expiry,elevation_expiry_passed,stale,frozen,reissue_without_elevation,expired promotion may not keep write authority
break_glass_revocation,break_glass_revoked_or_expired,blocked,blocked,new_activation_with_reason_and_justification,revocation is immediate
visibility_contract_drift,envelope_hash_or_contract_drift,stale,frozen,regenerate_visibility_envelope,prevents wide projection under stale contract
