postureId,capabilityState,visibilityDisposition,visibleToPatient,rankingEligible,warningCopyRequirement,overrideRequirement,consentImplication
CHOICE_001,direct_supported,recommended_visible,yes,yes,none,none,Standard provider selection may proceed directly into consent capture.
CHOICE_002,manual_supported,recommended_visible,yes,yes,manual routing explanation,none,Consent must still bind to manual route family and selected explanation.
CHOICE_003,manual_supported,visible_with_warning,yes,yes,required,warned_choice_ack_required,Consent blocked until override acknowledgement settles and selectionBindingHash is refreshed.
CHOICE_004,direct_supported,suppressed_unsafe,summary_only,no,suppressed unsafe summary,policy_override_required,No consent capture allowed until recovery produces a visible lawful choice surface.
CHOICE_005,unsupported,invalid_hidden,no,no,not_applicable,not_applicable,Provider is not a selectable target and may not appear in the visible frontier.
