bounceBackType,urgencyLevel,dominantCopy,reopenImplications,reachabilityRequirements,gpActionRequired,supervisorReviewMayBeMandatory
urgent_gp_return,urgent,urgent_action_now,urgent_bounce_back and immediate triage reacquire,urgent_return dependency plus direct professional-number route,yes,yes_when_loop_risk_or_identity_freeze
routine_gp_return,routine,reviewing_next_steps,unresolved_returned and governed practice reassessment,outcome_confirmation dependency remains current,yes,possible
patient_not_contactable,elevated,reviewing_next_steps_with_route_repair,no_contact_return_pending when threshold met,urgent_return or outcome_confirmation dependency plus contact repair journey,yes_if_review_or_reopen_required,possible_when_loop_risk_high
patient_declined,routine,reviewing_next_steps_choice_changed,unresolved_returned with alternative endpointing path,current patient route only,not_always,possible_when_repeated_low_change
pharmacy_unable_to_complete,elevated,reviewing_next_steps_gp_action_may_be_needed,unresolved_returned or urgent_bounce_back depending safety signal,outcome_confirmation dependency current and repair explicit when broken,yes,possible
referral_expired,elevated,reviewing_next_steps_referral_expired,unresolved_returned with requeue timing uplift,outcome_confirmation dependency current,yes_if_clinical_work_outstanding,possible_when_repeated
safeguarding_concern,urgent,urgent_action_now,urgent_bounce_back and safety-led reopen branch,direct urgent route plus monitored fallback,yes,yes
