threshold_ref,value,rationale,review_path,auto_apply_effect
tau_patient_floor,0.55,Reject candidates that do not sufficiently agree on patient identity or lineage,below floor routes to review or unmatched,required for any scored candidate
tau_service_floor,0.70,Prevent cross-service matching between unrelated pharmacy pathways,below floor routes to review or unmatched,required for any scored candidate
tau_route_floor,0.65,If routed dispatch exists at least provider or transport agreement must be credible,below floor routes to review or unmatched,required when outbound dispatch proof exists
tau_match_time,720,Apply exponential decay over a 12-hour match window,large drift lowers score and can force review,contributes to posterior rather than acting as a hard reject
tau_strong_match,0.74,Minimum weighted match score for strong-match posture,below threshold remains review_required,required for auto-apply
tau_posterior_strong,0.72,Prevents auto-apply where a runner-up remains too plausible,below threshold remains review_required,required for auto-apply
delta_match,0.12,Requires a clear gap between winner and runner-up,below threshold remains review_required,required for auto-apply
tau_contra_apply,0.20,Prevents auto-apply if contradiction evidence is materially present,above threshold remains review_required,required for auto-apply
