sourceKind,classificationOrDispatchHint,explicitBounceBackType,normalizedBounceBackType,trustClass,updateRecordAllowed,directUrgentRouteRequired,notes
outcome_observation,urgent_gp_action,,urgent_gp_return,high,false,true,352 outcome settlement maps directly into urgent return
outcome_observation,onward_referral,,routine_gp_return,high,true,false,352 onward referral reopens routine practice review
reachability_failure,route_health_blocked,,patient_not_contactable,medium,true,false,contact-route failure normalizes into patient not contactable
manual_capture,,patient_declined,patient_declined,medium,true,false,manual capture keeps explicit decline semantics
manual_capture,,pharmacy_unable_to_complete,pharmacy_unable_to_complete,medium,true,false,unable-to-complete stays separate from routine return
dispatch_failure,stale_choice_or_consent,,patient_declined,medium,true,false,dispatch settlement can normalize into patient decline
dispatch_failure,expired_or_timeout,,referral_expired,medium,true,false,dispatch expiry normalizes into referral expired
manual_capture,,safeguarding_concern,safeguarding_concern,medium,false,true,safeguarding forces urgent return channel handling
