surface,trigger,channel,message_class,example_text,suppression_rule
patient_shell,route_change,polite,route_summary,"Choose. Choose a pharmacy that still matches the current proof. Selected anchor Glenburn Pharmacy.",Deduplicate when route and selected anchor are unchanged.
patient_shell,repair_or_recovery_required,assertive,recovery_warning,"Recovery is required before this route can continue.",Suppress once state clears back to clear.
patient_shell,warned_choice_ack,polite,inline_ack_status,"Acknowledgement recorded.",Only publish after explicit acknowledgement action.
pharmacy_shell,route_change,polite,route_summary,"Handoff. Priya Singh. Selected anchor Amoxicillin 500mg. Promoted support dispatch_proof.",Deduplicate when route, case, and selected anchor are unchanged.
pharmacy_shell,blocked_recovery,assertive,recovery_warning,"Dispatch proof drift is blocking release.",Only publish for blocked recovery posture.
dispatch_drawer,open,polite,dialog_entry,"Referral confirmation drawer opened.",Publish once per open action.
queue_peek_drawer,open,polite,drawer_entry,"Queue context opened.",Publish once per open action.
