state,fixture,slot_state,patch_lease_state,session_state,compare_mode,insert_button,visible_reason,expected_behavior
insert_enabled_live_patch_lease,insert-enabled,live,live,live,after,enabled,,Insert queues provisional draft review against shown slot.
insert_blocked_stale_slot,insert-blocked-slot,stale,stale,live,both,disabled,stale_slot|selected_anchor_drift,Reason appears before click and insert stays frozen.
insert_blocked_stale_session,insert-blocked-session,live,blocked,stale,both,disabled,stale_session|decision_epoch_drift|publication_drift|trust_posture_drift,Reasons appear before click and same shell preserves draft text.
compare_open,compare-open,live,live,live,both,enabled,,Before and after wording are visible in clinical cards.
compare_closed,compare-closed,live,live,live,after,enabled,,After wording remains target-bound and readable.
narrow_stacked,narrow-stacked,live,live,live,both,enabled,,Compare columns stack inside the same rail on narrow viewport.
