fixture,stage_mode,trust_state,actionability,promotion_state,support_region_slot,pin_allowed,responsive_state,dominant_rule
summary-stub,summary_stub,shadow_only,observe_only,allowed,summary_stub,false,desktop_stage,Render one summary stub inside active workspace composition.
promoted,promoted,trusted,interactive,allowed,side_stage,true,desktop_stage,Promote only as bounded fourth support region.
pinned,pinned,trusted,interactive,pinned_by_user,side_stage,true,desktop_stage,Respect explicit pin while preserving DecisionDock dominance.
downgraded,downgraded,degraded,observe_only,blocked_by_trust,side_stage,false,desktop_stage,Fail closed and suppress fresh insert or pin affordances.
folded,folded,trusted,interactive,folded_by_viewport,folded_tab,true,narrow_folded,Fold to same-shell tab panel below split threshold.
