recoveryCaseId,resultClass,dominantReason,sameShellRecoveryEnvelopeRef,releaseRecoveryDispositionRef,routeFreezeDispositionRef,preserveAnchorState,dominantSummaryTier,nextActionLabel,source_refs,rationale
RCV_056_STALE_TUPLE_REBIND_V1,stale_recoverable,"route intent, governing object, or fence epoch drifted",RecoveryEnvelope::tuple-rebind,RRD_PATIENT_REQUEST_RECOVERY_ONLY,RFD_056_STALE_RECOVERABLE_V1,yes,last_safe_summary,Refresh current action,blueprint/patient-account-and-communications-blueprint.md#Patient action recovery contract; prompt/056.md,Tuple drift keeps the current shell and last safe summary visible while the route intent is revalidated.
RCV_056_POLICY_HOLD_V1,blocked_policy,"release freeze, channel freeze, safety preemption, or policy ceiling blocked mutation",RecoveryEnvelope::policy-hold,RRD_OPERATIONS_BOARD_FROZEN,RFD_056_POLICY_BLOCK_V1,yes,blocked_context,View governing policy hold,blueprint/platform-runtime-and-release-blueprint.md#ReleaseRecoveryDisposition; prompt/056.md,Policy blocks must degrade through the declared recovery disposition rather than a generic error state.
RCV_056_SCOPE_SWITCH_V1,denied_scope,"acting scope, grant family, or tuple hash no longer matches",RecoveryEnvelope::scope-switch,RRD_GOVERNANCE_HANDOFF_ONLY,RFD_056_SCOPE_DENIAL_V1,yes,scope_gap_summary,Reissue authority,blueprint/phase-0-the-foundation-protocol.md#6.6 Scoped mutation gate; prompt/056.md,Scope denial keeps the governed context visible while route authority is reissued or handed off.
RCV_056_REISSUE_OR_STEP_UP_V1,expired,"grant, session, or reply window expired",RecoveryEnvelope::reissue-or-step-up,RRD_SECURE_LINK_RECOVERY_ONLY,RFD_056_EXPIRED_V1,yes,checkpoint_summary,Reissue access,blueprint/phase-2-identity-and-echoes.md#Continuation authority and claim law; prompt/056.md,"Expiry must reopen governed reissue, step-up, or continuation recovery inside the same shell."
RCV_056_REVIEW_HOLD_V1,review_required,manual review or review-disposition hold is active,RecoveryEnvelope::review-hold,RRD_SUPPORT_WORKSPACE_READ_ONLY,RFD_056_REVIEW_HOLD_V1,yes,review_summary,View review disposition,blueprint/callback-and-clinician-messaging-loop.md#Mutation and settlement law; prompt/056.md,Review-required outcomes stay attached to the current anchor and governing object until the review settles.
RCV_056_RECONCILIATION_HOLD_V1,reconciliation_required,external confirmation or outcome evidence is disputed,RecoveryEnvelope::reconciliation-hold,RRD_PHARMACY_DISPATCH_RECOVERY,RFD_056_RECONCILIATION_HOLD_V1,yes,reconciliation_summary,Resolve disputed evidence,"blueprint/phase-6-the-pharmacy-loop.md#Outcome ingest, reconciliation, and closure; prompt/056.md",Reconciliation holds preserve the same shell and current object while disputed evidence is reconciled.
RCV_056_PUBLICATION_REFRESH_V1,publication_stale,"runtime publication, parity, or provenance drifted",RecoveryEnvelope::runtime-watch-refresh,RRD_PATIENT_INTAKE_RECOVERY,RFD_056_PUBLICATION_STALE_V1,yes,runtime_tuple_summary,Refresh published runtime tuple,blueprint/platform-runtime-and-release-blueprint.md#AudienceSurfaceRuntimeBinding; prompt/056.md,Runtime publication drift must freeze live mutation in place and route through the current release recovery disposition.
RCV_056_CONTACT_REPAIR_V1,contact_repair_required,reachability assessment or contact repair journey blocks the dependent action,RecoveryEnvelope::contact-route-repair,RRD_SUPPORT_CAPTURE_RECOVERY,RFD_056_CONTACT_REPAIR_V1,yes,blocked_action_summary,Repair contact route,blueprint/phase-0-the-foundation-protocol.md#6.5B Contact-route repair continuity rule; prompt/056.md,Reachability-dependent actions must preserve the blocked action context and reopen through the current contact repair journey.
