path,routeFamilyRef,routeKey,continuityKey,selectedAnchorPolicy,summary
/workspace/pharmacy,rf_pharmacy_console,lane,pharmacy.console,Pin the queue lane while a case remains active in the same shell.,Queue spine root with one active case pinned into the validation board.
/workspace/pharmacy/PHC-2057,rf_pharmacy_console,case,pharmacy.console,"Preserve the active case, line item, and checkpoint on same-shell case entry.",Case workbench route keeps the validation board and decision plane in one shell.
/workspace/pharmacy/PHC-2090/validate,rf_pharmacy_console,validate,pharmacy.console,Keep the current checkpoint and line-item anchor visible during validation review.,Validation route promotes checkpoint detail without detaching from the case workbench.
/workspace/pharmacy/PHC-2081/inventory,rf_pharmacy_console,inventory,pharmacy.console,Preserve the selected line item while inventory comparison posture changes.,"Inventory route shows supply delta, held posture, and table fallback inside the same shell."
/workspace/pharmacy/PHC-2124/resolve,rf_pharmacy_console,resolve,pharmacy.console,Keep outcome review tied to the active case and return token.,Resolve route keeps weak-match and manual-review truth explicit rather than resolved-looking.
/workspace/pharmacy/PHC-2072/handoff,rf_pharmacy_console,handoff,pharmacy.console,Freeze the current case and proof basis if handoff proof is contradictory.,"Handoff route distinguishes transport acceptance, provider acceptance, and authoritative proof."
/workspace/pharmacy/PHC-2103/assurance,rf_pharmacy_console,assurance,pharmacy.console,Urgent return and reopen-for-safety remain inside the same shell continuity frame.,Assurance route keeps reopen-for-safety and watch-window posture explicit.
