transition_id,machine_id,canonical_name,machine_family,phase_tags,state_axis_type,from_state,to_state,trigger,coordinator_owned,guards,authoritative_proofs,related_objects,degraded_posture,closure_blocker_interactions,source_refs,notes
SM_SUBMISSION_ENVELOPE_STATE__DRAFT__EVIDENCE_PENDING,SM_SUBMISSION_ENVELOPE_STATE,SubmissionEnvelope.state,canonical_shared_control,phase_0_foundation,lifecycle,draft,evidence_pending,Capture bundle or attachments persist on the pre-submit lineage.,no,SubmissionIngressRecord exists; Envelope remains the only pre-submit container,SubmissionIngressRecord; EvidenceCaptureBundle,SubmissionIngressRecord; EvidenceCaptureBundle,,,phase-0-the-foundation-protocol.md#1.1 SubmissionEnvelope; forensic-audit-findings.md#Finding 09 - Upload and audio quarantine rules were absent,
SM_SUBMISSION_ENVELOPE_STATE__EVIDENCE_PENDING__READY_TO_PROMOTE,SM_SUBMISSION_ENVELOPE_STATE,SubmissionEnvelope.state,canonical_shared_control,phase_0_foundation,lifecycle,evidence_pending,ready_to_promote,Readiness checks complete for promotion-safe submission.,no,Evidence readiness is promotable; No fallback review is open on the same envelope,SubmissionPromotionReadinessCheck; EvidenceClassificationDecision,TelephonyEvidenceReadinessAssessment; FallbackReviewCase,submitted_degraded,Fallback review stays closure-blocking until recovered,phase-0-the-foundation-protocol.md; forensic-audit-findings.md,
SM_SUBMISSION_ENVELOPE_STATE__READY_TO_PROMOTE__PROMOTED,SM_SUBMISSION_ENVELOPE_STATE,SubmissionEnvelope.state,canonical_shared_control,phase_0_foundation,lifecycle,ready_to_promote,promoted,Governed submit promotes the envelope into one Request.,no,Promotion command targets the current envelope version; No quarantine or safety blocker remains,SubmissionPromotionRecord; CommandSettlementRecord(authoritativeOutcomeState = settled),CommandSettlementRecord; SubmissionPromotionRecord; Request,,,phase-0-the-foundation-protocol.md#4 Canonical ingest and request promotion; phase-0-the-foundation-protocol.md#1.1 SubmissionEnvelope,
SM_SUBMISSION_ENVELOPE_STATE__DRAFT__ABANDONED,SM_SUBMISSION_ENVELOPE_STATE,SubmissionEnvelope.state,canonical_shared_control,phase_0_foundation,lifecycle,draft,abandoned,User or support abandons pre-submit capture.,no,No governed submit has been accepted,SubmissionAbandonmentRecord,SubmissionEnvelope,,,phase-0-the-foundation-protocol.md; forensic-audit-findings.md,
SM_SUBMISSION_ENVELOPE_STATE__EVIDENCE_PENDING__EXPIRED,SM_SUBMISSION_ENVELOPE_STATE,SubmissionEnvelope.state,canonical_shared_control,phase_0_foundation,lifecycle,evidence_pending,expired,Continuation or draft TTL expires before promotion.,no,Continuation grant and draft window are no longer valid,AccessGrantSupersessionRecord; DraftExpiryRecord,AccessGrant,draft_recoverable,,phase-0-the-foundation-protocol.md; forensic-audit-findings.md,
SM_REQUEST_WORKFLOW_STATE__SUBMITTED__INTAKE_NORMALIZED,SM_REQUEST_WORKFLOW_STATE,Request.workflowState,canonical_shared_control,phase_0_foundation; phase_3_human_checkpoint; phase_4_booking_engine; phase_5_network_horizon; phase_6_pharmacy_loop,workflow,submitted,intake_normalized,Promotion survives normalization and canonical ingest settlement.,yes,Submission promotion is settled; Current evidence snapshot is persisted,SubmissionPromotionRecord; NormalizedSubmission; CommandSettlementRecord(authoritativeOutcomeState = settled),SubmissionEnvelope; CommandSettlementRecord,,,phase-0-the-foundation-protocol.md; forensic-audit-findings.md,
SM_REQUEST_WORKFLOW_STATE__INTAKE_NORMALIZED__TRIAGE_READY,SM_REQUEST_WORKFLOW_STATE,Request.workflowState,canonical_shared_control,phase_0_foundation; phase_3_human_checkpoint; phase_4_booking_engine; phase_5_network_horizon; phase_6_pharmacy_loop,workflow,intake_normalized,triage_ready,Safety and identity axes settle enough for review queue admission.,yes,SafetyState is not urgent_diversion_required; Queue entry contract is computed,SafetyDecisionRecord; QueueAdmissionRecord,TriageTask; SafetyDecisionRecord,,,phase-0-the-foundation-protocol.md; forensic-audit-findings.md,
SM_REQUEST_WORKFLOW_STATE__TRIAGE_READY__TRIAGE_ACTIVE,SM_REQUEST_WORKFLOW_STATE,Request.workflowState,canonical_shared_control,phase_0_foundation; phase_3_human_checkpoint; phase_4_booking_engine; phase_5_network_horizon; phase_6_pharmacy_loop,workflow,triage_ready,triage_active,Active review or more-info/approval work is acknowledged on the lineage.,yes,A triage-side lease is active; Current DecisionEpoch or review context is live,RequestLifecycleLease; TriageLeaseSignal,TriageTask; RequestLifecycleLease; DecisionEpoch,,"Duplicate review, more-info, approval, and identity repair remain orthogonal blockers",phase-0-the-foundation-protocol.md#Canonical request model; phase-3-the-human-checkpoint.md#3A Triage contract and workspace state model,
SM_REQUEST_WORKFLOW_STATE__TRIAGE_ACTIVE__HANDOFF_ACTIVE,SM_REQUEST_WORKFLOW_STATE,Request.workflowState,canonical_shared_control,phase_0_foundation; phase_3_human_checkpoint; phase_4_booking_engine; phase_5_network_horizon; phase_6_pharmacy_loop,workflow,triage_active,handoff_active,A downstream child case is durably acknowledged on the same RequestLineage.,yes,Current DecisionEpoch is unsuperseded; LineageCaseLink(caseFamily) is acknowledged,LineageCaseLink; BookingOutcomeMilestone | HubCoordinationMilestone | PharmacyOutcomeMilestone,LineageCaseLink; BookingCase; HubCoordinationCase; PharmacyCase,,External confirmation gates and downstream blockers stay on the lineage,"phase-0-the-foundation-protocol.md#1.1B RequestLineage; phase-3-the-human-checkpoint.md#3G Direct resolution, downstream handoff seeds, and reopen mechanics",
SM_REQUEST_WORKFLOW_STATE__TRIAGE_ACTIVE__OUTCOME_RECORDED,SM_REQUEST_WORKFLOW_STATE,Request.workflowState,canonical_shared_control,phase_0_foundation; phase_3_human_checkpoint; phase_4_booking_engine; phase_5_network_horizon; phase_6_pharmacy_loop,workflow,triage_active,outcome_recorded,"Direct advice, direct completion, or direct endpoint outcome settles.",yes,Endpoint settlement is authoritative; No urgent preemption is pending,EndpointDecisionSettlement(authoritativeOutcomeState = settled); DirectOutcomeMilestone,EndpointDecisionSettlement; CommandSettlementRecord,,Residual blockers remain orthogonal to this milestone,"phase-3-the-human-checkpoint.md#3G Direct resolution, downstream handoff seeds, and reopen mechanics; phase-0-the-foundation-protocol.md#Canonical request model",
SM_REQUEST_WORKFLOW_STATE__HANDOFF_ACTIVE__OUTCOME_RECORDED,SM_REQUEST_WORKFLOW_STATE,Request.workflowState,canonical_shared_control,phase_0_foundation; phase_3_human_checkpoint; phase_4_booking_engine; phase_5_network_horizon; phase_6_pharmacy_loop,workflow,handoff_active,outcome_recorded,Child-domain outcome milestone settles after local truth is reconciled.,yes,Downstream case-local truth is authoritative; Any confirmation gate needed for the branch is satisfied or downgraded under policy,BookingOutcomeMilestone | HubCoordinationMilestone | PharmacyOutcomeMilestone; ExternalConfirmationGate or branch-local closure truth,BookingCase; HubCoordinationCase; PharmacyCase; ExternalConfirmationGate,,"Ambiguous booking, hub, or pharmacy truth keeps closure blocked until cleared","phase-4-the-booking-engine.md#4A Booking contract, case model, and state machine; phase-5-the-network-horizon.md#5A Network coordination contract, case model, and state machine; phase-6-the-pharmacy-loop.md#6A Pharmacy contract, case model, and state machine",
SM_REQUEST_WORKFLOW_STATE__OUTCOME_RECORDED__CLOSED,SM_REQUEST_WORKFLOW_STATE,Request.workflowState,canonical_shared_control,phase_0_foundation; phase_3_human_checkpoint; phase_4_booking_engine; phase_5_network_horizon; phase_6_pharmacy_loop,workflow,outcome_recorded,closed,LifecycleCoordinator evaluates a zero-blocker closure on the current lineage epoch.,yes,"Coordinator-materialized blocker sets are empty; No active lease, repair, duplicate, fallback, confirmation, reachability, or grant blocker remains",RequestClosureRecord(decision = close); Request.closure_blockers.changed -> empty set,RequestClosureRecord; DuplicateCluster; FallbackReviewCase; ExternalConfirmationGate,defer,Closure remains deferred while any blocker ref remains non-empty,phase-0-the-foundation-protocol.md#1.12 RequestClosureRecord; forensic-audit-findings.md#Finding 71 - Closure evaluation did not explicitly assert empty coordinator-materialized blocker sets,
SM_REQUEST_SAFETY_STATE__NOT_SCREENED__SCREEN_CLEAR,SM_REQUEST_SAFETY_STATE,Request.safetyState,canonical_shared_control,phase_0_foundation; phase_1_red_flag_gate; phase_3_human_checkpoint; phase_6_pharmacy_loop,safety,not_screened,screen_clear,Initial or resumed safety run clears urgent and residual risk.,no,Composite evidence snapshot is settled; No active safety preemption remains,SafetyDecisionRecord(requestedSafetyState = screen_clear),SafetyDecisionRecord; EvidenceSnapshot,,,phase-0-the-foundation-protocol.md; forensic-audit-findings.md,
SM_REQUEST_SAFETY_STATE__NOT_SCREENED__RESIDUAL_RISK_FLAGGED,SM_REQUEST_SAFETY_STATE,Request.safetyState,canonical_shared_control,phase_0_foundation; phase_1_red_flag_gate; phase_3_human_checkpoint; phase_6_pharmacy_loop,safety,not_screened,residual_risk_flagged,Safety run detects residual but not urgent risk.,no,Canonical safety rules run against the current snapshot,SafetyDecisionRecord(requestedSafetyState = residual_risk_flagged),SafetyDecisionRecord,,,phase-0-the-foundation-protocol.md; forensic-audit-findings.md,
SM_REQUEST_SAFETY_STATE__NOT_SCREENED__URGENT_DIVERSION_REQUIRED,SM_REQUEST_SAFETY_STATE,Request.safetyState,canonical_shared_control,phase_0_foundation; phase_1_red_flag_gate; phase_3_human_checkpoint; phase_6_pharmacy_loop,safety,not_screened,urgent_diversion_required,Initial safety run requires urgent diversion.,no,Urgent path is materially required and not yet durably issued,SafetyDecisionRecord(requestedSafetyState = urgent_diversion_required),UrgentDiversionSettlement; SafetyDecisionRecord,urgent_required,Closure blocks until urgent issuance is durably settled,phase-1-the-red-flag-gate.md; forensic-audit-findings.md#Finding 11 - Urgent diversion required and completed were collapsed,
SM_REQUEST_SAFETY_STATE__RESIDUAL_RISK_FLAGGED__URGENT_DIVERSION_REQUIRED,SM_REQUEST_SAFETY_STATE,Request.safetyState,canonical_shared_control,phase_0_foundation; phase_1_red_flag_gate; phase_3_human_checkpoint; phase_6_pharmacy_loop,safety,residual_risk_flagged,urgent_diversion_required,Materially new evidence escalates the case into urgent handling.,no,Evidence assimilation and re-safety completed on the latest snapshot,EvidenceAssimilationRecord; SafetyDecisionRecord(requestedSafetyState = urgent_diversion_required),EvidenceAssimilationRecord; MaterialDeltaAssessment; SafetyPreemptionRecord,urgent_required,,"phase-3-the-human-checkpoint.md#3D More-info loop, patient response threading, and re-safety; forensic-audit-findings.md#Finding 13 - Materially new evidence bypassed canonical re-safety",
SM_REQUEST_SAFETY_STATE__SCREEN_CLEAR__RESIDUAL_RISK_FLAGGED,SM_REQUEST_SAFETY_STATE,Request.safetyState,canonical_shared_control,phase_0_foundation; phase_1_red_flag_gate; phase_3_human_checkpoint; phase_6_pharmacy_loop,safety,screen_clear,residual_risk_flagged,Material evidence arrives and re-safety no longer clears completely.,no,MaterialDeltaAssessment requires re-safety,EvidenceAssimilationRecord; SafetyDecisionRecord(requestedSafetyState = residual_risk_flagged),EvidenceAssimilationRecord; MaterialDeltaAssessment,,,"phase-3-the-human-checkpoint.md#3D More-info loop, patient response threading, and re-safety",
SM_REQUEST_SAFETY_STATE__SCREEN_CLEAR__URGENT_DIVERSION_REQUIRED,SM_REQUEST_SAFETY_STATE,Request.safetyState,canonical_shared_control,phase_0_foundation; phase_1_red_flag_gate; phase_3_human_checkpoint; phase_6_pharmacy_loop,safety,screen_clear,urgent_diversion_required,Later evidence or callback outcome proves urgent routing is now required.,no,SafetyOrchestrator preempts routine flow on the current snapshot,SafetyPreemptionRecord; SafetyDecisionRecord(requestedSafetyState = urgent_diversion_required),SafetyPreemptionRecord; SafetyDecisionRecord,urgent_required,,phase-0-the-foundation-protocol.md; forensic-audit-findings.md,
SM_REQUEST_SAFETY_STATE__URGENT_DIVERSION_REQUIRED__URGENT_DIVERTED,SM_REQUEST_SAFETY_STATE,Request.safetyState,canonical_shared_control,phase_0_foundation; phase_1_red_flag_gate; phase_3_human_checkpoint; phase_6_pharmacy_loop,safety,urgent_diversion_required,urgent_diverted,"Urgent advice, escalation, or contact issuance is durably settled.",no,Urgent issuance is no longer merely required; Authoritative diversion proof binds to the same lineage,UrgentDiversionSettlement,UrgentDiversionSettlement,,,phase-1-the-red-flag-gate.md; forensic-audit-findings.md#Finding 11 - Urgent diversion required and completed were collapsed,
SM_REQUEST_IDENTITY_STATE__ANONYMOUS__PARTIAL_MATCH,SM_REQUEST_IDENTITY_STATE,Request.identityState,canonical_shared_control,phase_0_foundation; phase_2_identity_and_echoes,identity,anonymous,partial_match,IdentityBinding finds candidate matches but not yet durable patient binding.,no,IdentityBinding.bindingState is candidate or provisional_verified,IdentityBinding; CapabilityDecision,IdentityBinding,,,phase-0-the-foundation-protocol.md; forensic-audit-findings.md,
SM_REQUEST_IDENTITY_STATE__PARTIAL_MATCH__MATCHED,SM_REQUEST_IDENTITY_STATE,Request.identityState,canonical_shared_control,phase_0_foundation; phase_2_identity_and_echoes,identity,partial_match,matched,IdentityBinding verifies a patient but claim or writable authority is not yet complete.,no,"IdentityBinding.bindingState is verified_patient; patientRef remains derived, not hand-written",IdentityBinding(bindingState = verified_patient),IdentityBinding,,,phase-0-the-foundation-protocol.md#1.4 IdentityBinding; forensic-audit-findings.md#Finding 50 - The concrete Request schema dropped identity-binding references and treated patientRef as unconditional,
SM_REQUEST_IDENTITY_STATE__MATCHED__CLAIMED,SM_REQUEST_IDENTITY_STATE,Request.identityState,canonical_shared_control,phase_0_foundation; phase_2_identity_and_echoes,identity,matched,claimed,Claim or continuation redemption settles writable patient identity on the current lineage.,no,Current Session and RouteIntentBinding are live; No identity repair is active,SessionEstablishmentDecision; RouteIntentBinding; IdentityBindingAuthority settlement,Session; RouteIntentBinding; IdentityBinding,,,"phase-0-the-foundation-protocol.md#5.4 Claim, secure-link, and embedded access algorithm; phase-2-identity-and-echoes.md",
SM_EPISODE_STATE__OPEN__RESOLVED,SM_EPISODE_STATE,Episode.state,canonical_shared_control,phase_0_foundation,lifecycle,open,resolved,All related requests and branches satisfy closure policy.,yes,Every related RequestClosureRecord is close; Episode-level blocker refs are empty,EpisodeResolutionSettlement; RequestClosureRecord(decision = close),RequestClosureRecord; Episode,,"Identity repair, duplicate review, fallback review, and confirmation gates remain orthogonal blockers",phase-0-the-foundation-protocol.md#1.2 Episode; phase-0-the-foundation-protocol.md#Closure evaluation,
SM_EPISODE_STATE__RESOLVED__ARCHIVED,SM_EPISODE_STATE,Episode.state,canonical_shared_control,phase_0_foundation,lifecycle,resolved,archived,Retention and lifecycle policy archives the already resolved episode.,yes,Resolution is durable; Archive posture is legal for the episode scope,EpisodeArchiveRecord; DispositionEligibilityAssessment(eligibilityState = archive_only | delete_allowed),DispositionEligibilityAssessment,,,"phase-0-the-foundation-protocol.md#1.2 Episode; phase-9-the-assurance-ledger.md#Records lifecycle, retention, legal hold, and deletion engine",
SM_TELEPHONY_EVIDENCE_READINESS__AWAITING_RECORDING__AWAITING_TRANSCRIPT,SM_TELEPHONY_EVIDENCE_READINESS,TelephonyEvidenceReadinessAssessment.usabilityState,canonical_shared_control,phase_0_foundation; phase_2_identity_and_echoes,gate,awaiting_recording,awaiting_transcript,Recording lands but transcript is still required.,no,Recording availability is durable,CallRecordingReceipt; TelephonyEvidenceReadinessAssessment,CallSession,,,phase-0-the-foundation-protocol.md#1.3D TelephonyEvidenceReadinessAssessment; forensic-audit-findings.md#Finding 08 - Telephony evidence-readiness gate was missing,
SM_TELEPHONY_EVIDENCE_READINESS__AWAITING_TRANSCRIPT__AWAITING_STRUCTURED_CAPTURE,SM_TELEPHONY_EVIDENCE_READINESS,TelephonyEvidenceReadinessAssessment.usabilityState,canonical_shared_control,phase_0_foundation; phase_2_identity_and_echoes,gate,awaiting_transcript,awaiting_structured_capture,Transcript lands but required keypad or structured capture is incomplete.,no,Transcript sufficiency is settled; Required structured capture remains incomplete,TranscriptReadinessRecord; StructuredCaptureAssessment,CallSession,,,phase-0-the-foundation-protocol.md; forensic-audit-findings.md,
SM_TELEPHONY_EVIDENCE_READINESS__AWAITING_RECORDING__URGENT_LIVE_ONLY,SM_TELEPHONY_EVIDENCE_READINESS,TelephonyEvidenceReadinessAssessment.usabilityState,canonical_shared_control,phase_0_foundation; phase_2_identity_and_echoes,gate,awaiting_recording,urgent_live_only,Urgent live branch is the only safe path before routine evidence is promotable.,no,Urgent-live assessment requires conservative diversion,UrgentLiveAssessment,UrgentLiveAssessment,urgent_live_only,,phase-0-the-foundation-protocol.md#1.3D TelephonyEvidenceReadinessAssessment; forensic-audit-findings.md#Finding 08 - Telephony evidence-readiness gate was missing,
SM_TELEPHONY_EVIDENCE_READINESS__AWAITING_STRUCTURED_CAPTURE__SAFETY_USABLE,SM_TELEPHONY_EVIDENCE_READINESS,TelephonyEvidenceReadinessAssessment.usabilityState,canonical_shared_control,phase_0_foundation; phase_2_identity_and_echoes,gate,awaiting_structured_capture,safety_usable,"Recording, transcript, and structured capture together clear routine safety use.",no,PromotionReadiness is ready_to_seed or ready_to_promote,TelephonyEvidenceReadinessAssessment(usabilityState = safety_usable),TelephonyContinuationEligibility; SubmissionEnvelope,,,phase-0-the-foundation-protocol.md; forensic-audit-findings.md,
SM_TELEPHONY_EVIDENCE_READINESS__URGENT_LIVE_ONLY__MANUAL_REVIEW_ONLY,SM_TELEPHONY_EVIDENCE_READINESS,TelephonyEvidenceReadinessAssessment.usabilityState,canonical_shared_control,phase_0_foundation; phase_2_identity_and_echoes,gate,urgent_live_only,manual_review_only,Urgent live path ends without enough routine evidence for ordinary promotion.,no,Routine evidence still fails safety-usable threshold,TelephonyManualReviewDisposition(reviewState = open),TelephonyManualReviewDisposition,manual_review_only,,phase-0-the-foundation-protocol.md#1.3F TelephonyManualReviewDisposition,
SM_TELEPHONY_EVIDENCE_READINESS__MANUAL_REVIEW_ONLY__SAFETY_USABLE,SM_TELEPHONY_EVIDENCE_READINESS,TelephonyEvidenceReadinessAssessment.usabilityState,canonical_shared_control,phase_0_foundation; phase_2_identity_and_echoes,gate,manual_review_only,safety_usable,Manual review or transcription settles promotable evidence.,no,Manual review disposition is settled,TelephonyManualReviewDisposition(reviewState = settled); TelephonyEvidenceReadinessAssessment(usabilityState = safety_usable),TelephonyManualReviewDisposition,,,phase-0-the-foundation-protocol.md; forensic-audit-findings.md,
SM_TELEPHONY_EVIDENCE_READINESS__MANUAL_REVIEW_ONLY__UNUSABLE_TERMINAL,SM_TELEPHONY_EVIDENCE_READINESS,TelephonyEvidenceReadinessAssessment.usabilityState,canonical_shared_control,phase_0_foundation; phase_2_identity_and_echoes,gate,manual_review_only,unusable_terminal,Manual review concludes the capture cannot safely become routine intake.,no,No recoverable continuation remains,TelephonyManualReviewDisposition(reviewMode = abandon),TelephonyManualReviewDisposition,under_manual_review,,phase-0-the-foundation-protocol.md; forensic-audit-findings.md,
SM_TELEPHONY_CONTINUATION_ELIGIBILITY__NOT_ELIGIBLE__ELIGIBLE_SEEDED,SM_TELEPHONY_CONTINUATION_ELIGIBILITY,TelephonyContinuationEligibility.eligibilityState,canonical_shared_control,phase_0_foundation; phase_2_identity_and_echoes,gate,not_eligible,eligible_seeded,Readiness and identity confidence allow seeded continuation.,no,Evidence readiness is safety_usable or ready_to_seed; Lineage scope is proven,TelephonyContinuationEligibility(eligibilityState = eligible_seeded); AccessGrant(grantFamily = continuation_seeded_verified),TelephonyEvidenceReadinessAssessment; AccessGrant,,,phase-0-the-foundation-protocol.md; forensic-audit-findings.md,
SM_TELEPHONY_CONTINUATION_ELIGIBILITY__NOT_ELIGIBLE__ELIGIBLE_CHALLENGE,SM_TELEPHONY_CONTINUATION_ELIGIBILITY,TelephonyContinuationEligibility.eligibilityState,canonical_shared_control,phase_0_foundation; phase_2_identity_and_echoes,gate,not_eligible,eligible_challenge,Continuation is allowed only after a challenge rather than seeded verification.,no,Identity or destination confidence is insufficient for seeded continuation,TelephonyContinuationEligibility(eligibilityState = eligible_challenge); AccessGrant(grantFamily = continuation_challenge),AccessGrant,,,phase-0-the-foundation-protocol.md; forensic-audit-findings.md,
SM_TELEPHONY_CONTINUATION_ELIGIBILITY__NOT_ELIGIBLE__MANUAL_ONLY,SM_TELEPHONY_CONTINUATION_ELIGIBILITY,TelephonyContinuationEligibility.eligibilityState,canonical_shared_control,phase_0_foundation; phase_2_identity_and_echoes,gate,not_eligible,manual_only,Continuation cannot be safely granted on the current evidence.,no,GrantFamilyRecommendation = manual_only,TelephonyContinuationEligibility(eligibilityState = manual_only),TelephonyEvidenceReadinessAssessment,manual_only,,phase-0-the-foundation-protocol.md; forensic-audit-findings.md,
SM_IDENTITY_BINDING_STATE__CANDIDATE__PROVISIONAL_VERIFIED,SM_IDENTITY_BINDING_STATE,IdentityBinding.bindingState,canonical_shared_control,phase_0_foundation; phase_2_identity_and_echoes,identity,candidate,provisional_verified,Evidence is strong enough for controlled progress but not yet durable external consequence.,no,Link probability lower bounds meet provisional policy,IdentityBinding(bindingState = provisional_verified),IdentityBinding,,,phase-0-the-foundation-protocol.md; forensic-audit-findings.md,
SM_IDENTITY_BINDING_STATE__CANDIDATE__AMBIGUOUS,SM_IDENTITY_BINDING_STATE,IdentityBinding.bindingState,canonical_shared_control,phase_0_foundation; phase_2_identity_and_echoes,identity,candidate,ambiguous,Competing identity candidates remain unresolved.,no,Runner-up probability stays within ambiguity policy,IdentityBinding(bindingState = ambiguous),IdentityRepairCase,identity_hold,,phase-0-the-foundation-protocol.md; forensic-audit-findings.md,
SM_IDENTITY_BINDING_STATE__PROVISIONAL_VERIFIED__VERIFIED_PATIENT,SM_IDENTITY_BINDING_STATE,IdentityBinding.bindingState,canonical_shared_control,phase_0_foundation; phase_2_identity_and_echoes,identity,provisional_verified,verified_patient,Binding is durably verified to one patient.,no,Subject proof and match evidence satisfy verified threshold,IdentityBinding(bindingState = verified_patient),IdentityBinding,,,phase-0-the-foundation-protocol.md; forensic-audit-findings.md,
SM_IDENTITY_BINDING_STATE__VERIFIED_PATIENT__CORRECTION_PENDING,SM_IDENTITY_BINDING_STATE,IdentityBinding.bindingState,canonical_shared_control,phase_0_foundation; phase_2_identity_and_echoes,identity,verified_patient,correction_pending,Wrong-patient correction or identity challenge freezes the active binding.,no,IdentityRepairCase is opened,IdentityRepairCase; IdentityRepairFreezeRecord,IdentityRepairCase,identity_hold,Identity repair blocks closure and writable calmness,phase-0-the-foundation-protocol.md#1.5 IdentityRepairCase; forensic-audit-findings.md#Finding 69 - Wrong-patient correction rewrote canonical workflow state instead of attaching repair metadata,
SM_IDENTITY_BINDING_STATE__CORRECTION_PENDING__CORRECTED,SM_IDENTITY_BINDING_STATE,IdentityBinding.bindingState,canonical_shared_control,phase_0_foundation; phase_2_identity_and_echoes,identity,correction_pending,corrected,IdentityBindingAuthority settles corrected binding under release settlement.,no,Identity repair release settlement is current,IdentityRepairReleaseSettlement; IdentityBinding(bindingState = corrected),IdentityRepairReleaseSettlement,,,phase-0-the-foundation-protocol.md#1.5C IdentityRepairReleaseSettlement,
SM_IDENTITY_BINDING_STATE__CORRECTED__REVOKED,SM_IDENTITY_BINDING_STATE,IdentityBinding.bindingState,canonical_shared_control,phase_0_foundation; phase_2_identity_and_echoes,identity,corrected,revoked,The corrected binding is later superseded or revoked.,no,A newer settled binding exists or revocation policy applies,IdentityBinding(bindingState = revoked),IdentityBinding,,,phase-0-the-foundation-protocol.md; forensic-audit-findings.md,
SM_SESSION_STATE__ESTABLISHING__ACTIVE,SM_SESSION_STATE,Session.sessionState,canonical_shared_control,phase_0_foundation; phase_2_identity_and_echoes,identity,establishing,active,"Session establishment settles on the current grant, binding, and tuple.",no,SessionEstablishmentDecision is current; Identity binding and grant context still match,SessionEstablishmentDecision; Session(sessionState = active),SessionEstablishmentDecision; AccessGrant; RouteIntentBinding,,,phase-0-the-foundation-protocol.md; forensic-audit-findings.md,
SM_SESSION_STATE__ACTIVE__STEP_UP_REQUIRED,SM_SESSION_STATE,Session.sessionState,canonical_shared_control,phase_0_foundation; phase_2_identity_and_echoes,identity,active,step_up_required,"Policy, risk, or scope change requires additional assurance before continuing.",no,Higher assurance is required for the target action,CapabilityDecision; Session(sessionState = step_up_required),CapabilityDecision,claim_pending,,phase-0-the-foundation-protocol.md; forensic-audit-findings.md,
