transition_id,machine_id,canonical_name,machine_family,phase_tags,state_axis_type,from_state,to_state,trigger,coordinator_owned,guards,authoritative_proofs,related_objects,degraded_posture,closure_blocker_interactions,source_refs,notes
SM_HUB_COORDINATION_CASE_STATUS__CANDIDATE_REVALIDATING__NATIVE_BOOKING_PENDING,SM_HUB_COORDINATION_CASE_STATUS,HubCoordinationCase.status,hub_coordination,phase_5_network_horizon,case_local,candidate_revalidating,native_booking_pending,Native booking commit is underway.,no,Selected candidate remains current under the active snapshot,HubCommitAttempt; HubOfferToConfirmationTruthProjection(confirmationTruthState = native_booking_pending),HubCommitAttempt; HubOfferToConfirmationTruthProjection,,,"phase-5-the-network-horizon.md#5F Native hub booking commit, practice continuity, and cross-org messaging",
SM_HUB_COORDINATION_CASE_STATUS__NATIVE_BOOKING_PENDING__CONFIRMATION_PENDING,SM_HUB_COORDINATION_CASE_STATUS,HubCoordinationCase.status,hub_coordination,phase_5_network_horizon,case_local,native_booking_pending,confirmation_pending,Native booking commit still awaits authoritative confirmation.,no,Current truth tuple still references the active attempt,HubOfferToConfirmationTruthProjection(confirmationTruthState = confirmation_pending),HubOfferToConfirmationTruthProjection; ExternalConfirmationGate,,Confirmation ambiguity and practice visibility remain open,"phase-5-the-network-horizon.md#5F Native hub booking commit, practice continuity, and cross-org messaging",
SM_HUB_COORDINATION_CASE_STATUS__CONFIRMATION_PENDING__BOOKED_PENDING_PRACTICE_ACK,SM_HUB_COORDINATION_CASE_STATUS,HubCoordinationCase.status,hub_coordination,phase_5_network_horizon,case_local,confirmation_pending,booked_pending_practice_ack,Hub-native confirmation settles but the origin practice still owes acknowledgement.,no,Current truth projection confirms booking and practice ack generation is current,HubOfferToConfirmationTruthProjection(confirmationTruthState = confirmed_pending_practice_ack); PracticeAcknowledgementRecord(ackState = pending),HubOfferToConfirmationTruthProjection; PracticeAcknowledgementRecord,,Practice acknowledgement remains an open case blocker,"phase-5-the-network-horizon.md#5F Native hub booking commit, practice continuity, and cross-org messaging",
SM_HUB_COORDINATION_CASE_STATUS__BOOKED_PENDING_PRACTICE_ACK__BOOKED,SM_HUB_COORDINATION_CASE_STATUS,HubCoordinationCase.status,hub_coordination,phase_5_network_horizon,case_local,booked_pending_practice_ack,booked,Current practice acknowledgement debt is resolved or policy-exempt for the current generation.,no,PracticeAcknowledgementRecord ackState = acknowledged | not_required,PracticeAcknowledgementRecord; HubOfferToConfirmationTruthProjection(practiceVisibilityState = acknowledged | exception_granted),PracticeAcknowledgementRecord; HubOfferToConfirmationTruthProjection,,,"phase-5-the-network-horizon.md#5H Patient communications, network reminders, manage flows, and practice visibility",
SM_HUB_COORDINATION_CASE_STATUS__COORDINATOR_SELECTING__CALLBACK_TRANSFER_PENDING,SM_HUB_COORDINATION_CASE_STATUS,HubCoordinationCase.status,hub_coordination,phase_5_network_horizon,case_local,coordinator_selecting,callback_transfer_pending,Callback fallback is selected but not yet durably linked.,no,Fallback type is callback_request or callback_transfer,HubFallbackRecord(state = proposed); CallbackFallbackRecord,HubFallbackRecord; CallbackCase,,Fallback linkage remains a closure blocker,"phase-5-the-network-horizon.md#5G No-slot handling, urgent bounce-back, callback fallback, and reopen mechanics",
SM_HUB_COORDINATION_CASE_STATUS__CALLBACK_TRANSFER_PENDING__CALLBACK_OFFERED,SM_HUB_COORDINATION_CASE_STATUS,HubCoordinationCase.status,hub_coordination,phase_5_network_horizon,case_local,callback_transfer_pending,callback_offered,Current CallbackCase and CallbackExpectationEnvelope are durably linked and patient-visible.,no,CallbackExpectationEnvelope exists for the current fallback fence,HubFallbackRecord(state = transferred); CallbackExpectationEnvelope,HubFallbackRecord; CallbackExpectationEnvelope; CallbackCase,,,"phase-5-the-network-horizon.md#5G No-slot handling, urgent bounce-back, callback fallback, and reopen mechanics",
SM_HUB_COORDINATION_CASE_STATUS__COORDINATOR_SELECTING__ESCALATED_BACK,SM_HUB_COORDINATION_CASE_STATUS,HubCoordinationCase.status,hub_coordination,phase_5_network_horizon,case_local,coordinator_selecting,escalated_back,Case is durably returned to practice rather than staying in hub coordination.,no,HubReturnToPracticeRecord exists,HubReturnToPracticeRecord; HubFallbackRecord,HubFallbackRecord,,,"phase-5-the-network-horizon.md#5G No-slot handling, urgent bounce-back, callback fallback, and reopen mechanics",
SM_HUB_COORDINATION_CASE_STATUS__BOOKED__CLOSED,SM_HUB_COORDINATION_CASE_STATUS,HubCoordinationCase.status,hub_coordination,phase_5_network_horizon,case_local,booked,closed,OpenCaseBlockers on the hub case are empty and closure is legal.,no,"Practice visibility, fallback linkage, supplier drift, and ownership blockers are all cleared",HubCaseClosureRecord; RequestClosureRecord(decision = close),RequestClosureRecord; HubOfferToConfirmationTruthProjection,,,"phase-5-the-network-horizon.md#5A Network coordination contract, case model, and state machine",
SM_HUB_CONFIRMATION_TRUTH__NO_COMMIT__CANDIDATE_REVALIDATING,SM_HUB_CONFIRMATION_TRUTH,HubOfferToConfirmationTruthProjection.confirmationTruthState,hub_coordination,phase_5_network_horizon,continuity,no_commit,candidate_revalidating,A selected hub candidate enters revalidation.,no,Selected candidate source version and offer set hash remain current,HubCommitAttempt; HubOfferToConfirmationTruthProjection,HubCommitAttempt,,,"phase-5-the-network-horizon.md#5F Native hub booking commit, practice continuity, and cross-org messaging",
SM_HUB_CONFIRMATION_TRUTH__CANDIDATE_REVALIDATING__NATIVE_BOOKING_PENDING,SM_HUB_CONFIRMATION_TRUTH,HubOfferToConfirmationTruthProjection.confirmationTruthState,hub_coordination,phase_5_network_horizon,continuity,candidate_revalidating,native_booking_pending,Native booking is dispatched on the current candidate tuple.,no,Current offer session and selected candidate still match,HubCommitAttempt; HubBookingEvidenceBundle,HubCommitAttempt; HubBookingEvidenceBundle,,,"phase-5-the-network-horizon.md#5F Native hub booking commit, practice continuity, and cross-org messaging",
SM_HUB_CONFIRMATION_TRUTH__NATIVE_BOOKING_PENDING__CONFIRMATION_PENDING,SM_HUB_CONFIRMATION_TRUTH,HubOfferToConfirmationTruthProjection.confirmationTruthState,hub_coordination,phase_5_network_horizon,continuity,native_booking_pending,confirmation_pending,Commit started but authoritative confirmation is not yet complete.,no,Truth tuple remains current,HubOfferToConfirmationTruthProjection(confirmationTruthState = confirmation_pending),ExternalConfirmationGate,,,"phase-5-the-network-horizon.md#5F Native hub booking commit, practice continuity, and cross-org messaging",
SM_HUB_CONFIRMATION_TRUTH__CONFIRMATION_PENDING__CONFIRMED_PENDING_PRACTICE_ACK,SM_HUB_CONFIRMATION_TRUTH,HubOfferToConfirmationTruthProjection.confirmationTruthState,hub_coordination,phase_5_network_horizon,continuity,confirmation_pending,confirmed_pending_practice_ack,"Booking confirmation is authoritative enough, but origin-practice visibility debt remains.",no,Current ackGeneration is unresolved,HubAppointmentRecord; PracticeAcknowledgementRecord(ackState = pending),HubAppointmentRecord; PracticeAcknowledgementRecord,,,"phase-5-the-network-horizon.md#5F Native hub booking commit, practice continuity, and cross-org messaging; phase-5-the-network-horizon.md#5H Patient communications, network reminders, manage flows, and practice visibility",
SM_HUB_CONFIRMATION_TRUTH__CONFIRMED_PENDING_PRACTICE_ACK__CONFIRMED,SM_HUB_CONFIRMATION_TRUTH,HubOfferToConfirmationTruthProjection.confirmationTruthState,hub_coordination,phase_5_network_horizon,continuity,confirmed_pending_practice_ack,confirmed,Practice acknowledgement debt clears on the current generation.,no,ackState = acknowledged | not_required,PracticeAcknowledgementRecord; HubOfferToConfirmationTruthProjection(practiceVisibilityState = acknowledged | exception_granted),PracticeAcknowledgementRecord,,,"phase-5-the-network-horizon.md#5H Patient communications, network reminders, manage flows, and practice visibility",
SM_HUB_CONFIRMATION_TRUTH__CONFIRMATION_PENDING__DISPUTED,SM_HUB_CONFIRMATION_TRUTH,HubOfferToConfirmationTruthProjection.confirmationTruthState,hub_coordination,phase_5_network_horizon,continuity,confirmation_pending,disputed,Competing evidence or supplier drift makes confirmation ambiguous.,no,Current truth tuple no longer proves one calm booking chain,HubOfferToConfirmationTruthProjection(confirmationTruthState = disputed),HubCommitAttempt; PracticeAcknowledgementRecord,,,"phase-5-the-network-horizon.md#5F Native hub booking commit, practice continuity, and cross-org messaging",
SM_HUB_CONFIRMATION_TRUTH__DISPUTED__SUPERSEDED,SM_HUB_CONFIRMATION_TRUTH,HubOfferToConfirmationTruthProjection.confirmationTruthState,hub_coordination,phase_5_network_horizon,continuity,disputed,superseded,A later authoritative tuple replaces the disputed projection.,no,Newer truth tuple is current,HubOfferToConfirmationTruthProjection(confirmationTruthState = superseded),HubAppointmentRecord,,,"phase-5-the-network-horizon.md#5F Native hub booking commit, practice continuity, and cross-org messaging",
SM_PHARMACY_CASE_STATUS__CANDIDATE_RECEIVED__RULES_EVALUATING,SM_PHARMACY_CASE_STATUS,PharmacyCase.status,pharmacy,phase_6_pharmacy_loop,case_local,candidate_received,rules_evaluating,Service type and pathway eligibility are computed for the new pharmacy branch.,no,Pharmacy child LineageCaseLink is current; DecisionEpoch is unsuperseded,ServiceTypeDecision; PathwayEligibilityEvaluation,ServiceTypeDecision; PathwayEligibilityEvaluation,,,"phase-6-the-pharmacy-loop.md#6A Pharmacy contract, case model, and state machine",
SM_PHARMACY_CASE_STATUS__RULES_EVALUATING__INELIGIBLE_RETURNED,SM_PHARMACY_CASE_STATUS,PharmacyCase.status,pharmacy,phase_6_pharmacy_loop,case_local,rules_evaluating,ineligible_returned,Pathway rules reject safe pharmacy progression and return the work.,no,Eligibility evaluation recommends return,PathwayEligibilityEvaluation(recommendedLane = return),PathwayEligibilityEvaluation,,,"phase-6-the-pharmacy-loop.md#6B Eligibility engine, pathway rules, and versioned policy packs",
SM_PHARMACY_CASE_STATUS__RULES_EVALUATING__ELIGIBLE_CHOICE_PENDING,SM_PHARMACY_CASE_STATUS,PharmacyCase.status,pharmacy,phase_6_pharmacy_loop,case_local,rules_evaluating,eligible_choice_pending,Pathway rules allow provider choice and referral progression.,no,Eligibility evaluation recommends pharmacy lane,PathwayEligibilityEvaluation(recommendedLane = pharmacy),PharmacyChoiceSession,,,"phase-6-the-pharmacy-loop.md#6B Eligibility engine, pathway rules, and versioned policy packs",
SM_PHARMACY_CASE_STATUS__ELIGIBLE_CHOICE_PENDING__PROVIDER_SELECTED,SM_PHARMACY_CASE_STATUS,PharmacyCase.status,pharmacy,phase_6_pharmacy_loop,case_local,eligible_choice_pending,provider_selected,A provider is durably selected from the current choice session.,no,Choice session and ranking tuple remain current,PharmacyChoiceSession; PharmacyChoiceOverrideAcknowledgement when required,PharmacyChoiceSession; PharmacyChoiceProof,,,"phase-6-the-pharmacy-loop.md#6C Pharmacy discovery, provider choice, and directory abstraction",
SM_PHARMACY_CASE_STATUS__PROVIDER_SELECTED__CONSENT_PENDING,SM_PHARMACY_CASE_STATUS,PharmacyCase.status,pharmacy,phase_6_pharmacy_loop,case_local,provider_selected,consent_pending,"Selection exists but valid referral consent is missing, expired, or withdrawn.",no,Current PharmacyConsentCheckpoint is not satisfied,PharmacyConsentCheckpoint(checkpointState = expiring | renewal_required | withdrawn | revoked_post_dispatch | withdrawal_reconciliation | recovery_required),PharmacyConsentCheckpoint,,Consent checkpoint blocks dispatch and calm pharmacy reassurance,"phase-6-the-pharmacy-loop.md#6A Pharmacy contract, case model, and state machine",
SM_PHARMACY_CASE_STATUS__PROVIDER_SELECTED__PACKAGE_READY,SM_PHARMACY_CASE_STATUS,PharmacyCase.status,pharmacy,phase_6_pharmacy_loop,case_local,provider_selected,package_ready,Valid consent exists and the canonical referral package is frozen.,no,Current PharmacyConsentCheckpoint.checkpointState = satisfied,PharmacyConsentCheckpoint(checkpointState = satisfied); PharmacyReferralPackage(packageState = frozen),PharmacyConsentCheckpoint; PharmacyReferralPackage,,,"phase-6-the-pharmacy-loop.md#6D Referral pack composer, dispatch adapters, and transport contract",
SM_PHARMACY_CASE_STATUS__PACKAGE_READY__CONSENT_PENDING,SM_PHARMACY_CASE_STATUS,PharmacyCase.status,pharmacy,phase_6_pharmacy_loop,case_local,package_ready,consent_pending,"Provider, scope, or consent drift invalidates the prior package.",no,Consent checkpoint no longer remains satisfied,PharmacyConsentCheckpoint; PharmacyConsentRevocationRecord,PharmacyConsentCheckpoint; PharmacyConsentRevocationRecord,,,"phase-6-the-pharmacy-loop.md#6D Referral pack composer, dispatch adapters, and transport contract",
SM_PHARMACY_CASE_STATUS__PACKAGE_READY__DISPATCH_PENDING,SM_PHARMACY_CASE_STATUS,PharmacyCase.status,pharmacy,phase_6_pharmacy_loop,case_local,package_ready,dispatch_pending,Dispatch attempt begins on the frozen package and provider tuple.,no,Current consent checkpoint remains satisfied; Current route intent and request ownership fences still match,PharmacyDispatchAttempt(status = created); CommandActionRecord,PharmacyDispatchAttempt; PharmacyConsentCheckpoint; RequestLifecycleLease,,,"phase-6-the-pharmacy-loop.md#6D Referral pack composer, dispatch adapters, and transport contract",
SM_PHARMACY_CASE_STATUS__DISPATCH_PENDING__REFERRED,SM_PHARMACY_CASE_STATUS,PharmacyCase.status,pharmacy,phase_6_pharmacy_loop,case_local,dispatch_pending,referred,Dispatch proof is sufficient for referral handoff under the transport assurance profile.,no,Relevant confirmation gate is created or refreshed,PharmacyDispatchAttempt(status = proof_satisfied); ExternalConfirmationGate,PharmacyDispatchAttempt; ExternalConfirmationGate,,,"phase-6-the-pharmacy-loop.md#6D Referral pack composer, dispatch adapters, and transport contract",
SM_PHARMACY_CASE_STATUS__REFERRED__CONSULTATION_OUTCOME_PENDING,SM_PHARMACY_CASE_STATUS,PharmacyCase.status,pharmacy,phase_6_pharmacy_loop,case_local,referred,consultation_outcome_pending,Referral is durably dispatched and the case awaits pharmacy outcome.,no,Current dispatch tuple remains matched to the package and provider,PharmacyDispatchAttempt(status = proof_satisfied); PharmacyContinuityEvidenceProjection,PharmacyDispatchAttempt; PharmacyContinuityEvidenceProjection,,,"phase-6-the-pharmacy-loop.md#6E Patient instructions, referral status, and pharmacy-facing UX logic",
SM_PHARMACY_CASE_STATUS__CONSULTATION_OUTCOME_PENDING__RESOLVED_BY_PHARMACY,SM_PHARMACY_CASE_STATUS,PharmacyCase.status,pharmacy,phase_6_pharmacy_loop,case_local,consultation_outcome_pending,resolved_by_pharmacy,Pharmacy outcome is strong enough to settle the branch locally.,no,Outcome source correlation is strong and no reconciliation gate remains open,PharmacyOutcomeRecord; PharmacyOutcomeMilestone,PharmacyOutcomeRecord; CommandSettlementRecord,,,"phase-6-the-pharmacy-loop.md#6F Outcome ingest, Update Record observation, and reconciliation",
SM_PHARMACY_CASE_STATUS__CONSULTATION_OUTCOME_PENDING__UNRESOLVED_RETURNED,SM_PHARMACY_CASE_STATUS,PharmacyCase.status,pharmacy,phase_6_pharmacy_loop,case_local,consultation_outcome_pending,unresolved_returned,Outcome proves unresolved return to practice rather than pharmacy resolution.,no,Return evidence is strong enough,PharmacyOutcomeRecord; PharmacyReopenSignal,PharmacyOutcomeRecord,,,"phase-6-the-pharmacy-loop.md#6G Bounce-back, urgent return, and reopen mechanics",
SM_PHARMACY_CASE_STATUS__CONSULTATION_OUTCOME_PENDING__URGENT_BOUNCE_BACK,SM_PHARMACY_CASE_STATUS,PharmacyCase.status,pharmacy,phase_6_pharmacy_loop,case_local,consultation_outcome_pending,urgent_bounce_back,Urgent return or bounce-back is required.,no,Urgency carry floor and bounce-back record are current,PharmacyBounceBackRecord,PharmacyBounceBackRecord,,Urgent bounce-back remains an explicit continuation path,"phase-6-the-pharmacy-loop.md#6G Bounce-back, urgent return, and reopen mechanics",
SM_PHARMACY_CASE_STATUS__CONSULTATION_OUTCOME_PENDING__NO_CONTACT_RETURN_PENDING,SM_PHARMACY_CASE_STATUS,PharmacyCase.status,pharmacy,phase_6_pharmacy_loop,case_local,consultation_outcome_pending,no_contact_return_pending,No-contact return is required rather than quiet closure.,no,Reachability plan or outcome evidence proves no contact return,PharmacyReachabilityPlan; PharmacyOutcomeRecord,PharmacyReachabilityPlan; PharmacyOutcomeRecord,,No-contact return must remain explicit and cannot auto-close,"phase-6-the-pharmacy-loop.md#6G Bounce-back, urgent return, and reopen mechanics",
SM_PHARMACY_CASE_STATUS__CONSULTATION_OUTCOME_PENDING__OUTCOME_RECONCILIATION_PENDING,SM_PHARMACY_CASE_STATUS,PharmacyCase.status,pharmacy,phase_6_pharmacy_loop,case_local,consultation_outcome_pending,outcome_reconciliation_pending,Weak or ambiguous outcome truth requires case-local reconciliation review.,no,Current outcome source is weakly correlated or contradictory,PharmacyOutcomeReconciliationGate; PharmacyOutcomeRecord,PharmacyOutcomeReconciliationGate; PharmacyOutcomeRecord,,Outcome reconciliation remains open until resolved,"phase-6-the-pharmacy-loop.md#6F Outcome ingest, Update Record observation, and reconciliation",
SM_PHARMACY_CASE_STATUS__OUTCOME_RECONCILIATION_PENDING__RESOLVED_BY_PHARMACY,SM_PHARMACY_CASE_STATUS,PharmacyCase.status,pharmacy,phase_6_pharmacy_loop,case_local,outcome_reconciliation_pending,resolved_by_pharmacy,Reconciliation resolves in favor of pharmacy completion.,no,Current reconciliation gate is settled,PharmacyOutcomeReconciliationGate; PharmacyOutcomeRecord,PharmacyOutcomeReconciliationGate,,,"phase-6-the-pharmacy-loop.md#6F Outcome ingest, Update Record observation, and reconciliation",
SM_PHARMACY_CASE_STATUS__OUTCOME_RECONCILIATION_PENDING__UNRESOLVED_RETURNED,SM_PHARMACY_CASE_STATUS,PharmacyCase.status,pharmacy,phase_6_pharmacy_loop,case_local,outcome_reconciliation_pending,unresolved_returned,Reconciliation resolves to unresolved return-to-practice.,no,Current reconciliation gate is settled,PharmacyOutcomeReconciliationGate; PharmacyOutcomeRecord,PharmacyOutcomeReconciliationGate,,,"phase-6-the-pharmacy-loop.md#6G Bounce-back, urgent return, and reopen mechanics",
SM_PHARMACY_CASE_STATUS__OUTCOME_RECONCILIATION_PENDING__URGENT_BOUNCE_BACK,SM_PHARMACY_CASE_STATUS,PharmacyCase.status,pharmacy,phase_6_pharmacy_loop,case_local,outcome_reconciliation_pending,urgent_bounce_back,Reconciliation concludes urgent bounce-back is required.,no,Current reconciliation gate is settled,PharmacyOutcomeReconciliationGate; PharmacyBounceBackRecord,PharmacyOutcomeReconciliationGate; PharmacyBounceBackRecord,,,"phase-6-the-pharmacy-loop.md#6G Bounce-back, urgent return, and reopen mechanics",
SM_PHARMACY_CASE_STATUS__OUTCOME_RECONCILIATION_PENDING__NO_CONTACT_RETURN_PENDING,SM_PHARMACY_CASE_STATUS,PharmacyCase.status,pharmacy,phase_6_pharmacy_loop,case_local,outcome_reconciliation_pending,no_contact_return_pending,Reconciliation concludes no-contact return remains the live branch.,no,Current reconciliation gate is settled,PharmacyOutcomeReconciliationGate; PharmacyReachabilityPlan,PharmacyOutcomeReconciliationGate; PharmacyReachabilityPlan,,,"phase-6-the-pharmacy-loop.md#6G Bounce-back, urgent return, and reopen mechanics",
SM_PHARMACY_CASE_STATUS__RESOLVED_BY_PHARMACY__CLOSED,SM_PHARMACY_CASE_STATUS,PharmacyCase.status,pharmacy,phase_6_pharmacy_loop,case_local,resolved_by_pharmacy,closed,"Resolved pharmacy branch has no remaining blocker, consent, dispatch, or outcome debt.",no,Current closure blocker refs are empty,PharmacyClosureSettlement; RequestClosureRecord(decision = close),RequestClosureRecord,,,"phase-6-the-pharmacy-loop.md#6H Practice visibility, operations queue, and pharmacy exception handling",
SM_PHARMACY_CONSENT_CHECKPOINT__SATISFIED__EXPIRING,SM_PHARMACY_CONSENT_CHECKPOINT,PharmacyConsentCheckpoint.checkpointState,pharmacy,phase_6_pharmacy_loop,gate,satisfied,expiring,Consent approaches expiry under the same provider and package scope.,no,Consent record is still current but nearing expiry,PharmacyConsentCheckpoint(checkpointState = expiring),PharmacyConsentRecord,,,"phase-6-the-pharmacy-loop.md#6A Pharmacy contract, case model, and state machine",
SM_PHARMACY_CONSENT_CHECKPOINT__EXPIRING__RENEWAL_REQUIRED,SM_PHARMACY_CONSENT_CHECKPOINT,PharmacyConsentCheckpoint.checkpointState,pharmacy,phase_6_pharmacy_loop,gate,expiring,renewal_required,Consent can no longer authorize dispatch or continuation.,no,Current consent expires or drifts out of scope,PharmacyConsentCheckpoint(checkpointState = renewal_required),PharmacyConsentRecord,,,"phase-6-the-pharmacy-loop.md#6A Pharmacy contract, case model, and state machine",
SM_PHARMACY_CONSENT_CHECKPOINT__SATISFIED__WITHDRAWN,SM_PHARMACY_CONSENT_CHECKPOINT,PharmacyConsentCheckpoint.checkpointState,pharmacy,phase_6_pharmacy_loop,gate,satisfied,withdrawn,Consent is withdrawn before dispatch.,no,Withdrawal is authoritative and pre-dispatch,PharmacyConsentRevocationRecord(revocationKind = pre_dispatch),PharmacyConsentRevocationRecord,,,"phase-6-the-pharmacy-loop.md#6A Pharmacy contract, case model, and state machine",
SM_PHARMACY_CONSENT_CHECKPOINT__SATISFIED__REVOKED_POST_DISPATCH,SM_PHARMACY_CONSENT_CHECKPOINT,PharmacyConsentCheckpoint.checkpointState,pharmacy,phase_6_pharmacy_loop,gate,satisfied,revoked_post_dispatch,Consent is revoked after dispatch already occurred.,no,Revocation kind is post_dispatch,PharmacyConsentRevocationRecord(revocationKind = post_dispatch),PharmacyConsentRevocationRecord; PharmacyDispatchAttempt,,,"phase-6-the-pharmacy-loop.md#6A Pharmacy contract, case model, and state machine",
SM_PHARMACY_CONSENT_CHECKPOINT__REVOKED_POST_DISPATCH__WITHDRAWAL_RECONCILIATION,SM_PHARMACY_CONSENT_CHECKPOINT,PharmacyConsentCheckpoint.checkpointState,pharmacy,phase_6_pharmacy_loop,gate,revoked_post_dispatch,withdrawal_reconciliation,Withdrawal must be reconciled downstream after dispatch already left the platform.,no,Downstream withdrawal state is not_required | requested | confirmed | disputed,PharmacyConsentRevocationRecord; PharmacyConsentCheckpoint(checkpointState = withdrawal_reconciliation),PharmacyConsentRevocationRecord,,,"phase-6-the-pharmacy-loop.md#6A Pharmacy contract, case model, and state machine",
SM_PHARMACY_CONSENT_CHECKPOINT__WITHDRAWAL_RECONCILIATION__RECOVERY_REQUIRED,SM_PHARMACY_CONSENT_CHECKPOINT,PharmacyConsentCheckpoint.checkpointState,pharmacy,phase_6_pharmacy_loop,gate,withdrawal_reconciliation,recovery_required,Withdrawal cannot be fully reconciled and needs governed recovery.,no,Current downstream acknowledgement remains disputed or impossible_after_handoff,PharmacyConsentRevocationRecord; ReleaseRecoveryDisposition,ReleaseRecoveryDisposition,,,"phase-6-the-pharmacy-loop.md#6A Pharmacy contract, case model, and state machine",
SM_PHARMACY_DISPATCH_STATUS__CREATED__ADAPTER_DISPATCHED,SM_PHARMACY_DISPATCH_STATUS,PharmacyDispatchAttempt.status,pharmacy,phase_6_pharmacy_loop,settlement,created,adapter_dispatched,Adapter dispatch begins on the frozen plan and package tuple.,no,dispatchPlanHash and packageHash still match; Current RouteIntentBinding and RequestLifecycleLease fences are current,AdapterDispatchAttempt; CommandActionRecord,PharmacyDispatchPlan; RouteIntentBinding; RequestLifecycleLease,,,"phase-6-the-pharmacy-loop.md#6D Referral pack composer, dispatch adapters, and transport contract",
SM_PHARMACY_DISPATCH_STATUS__ADAPTER_DISPATCHED__TRANSPORT_ACCEPTED,SM_PHARMACY_DISPATCH_STATUS,PharmacyDispatchAttempt.status,pharmacy,phase_6_pharmacy_loop,settlement,adapter_dispatched,transport_accepted,Transport layer accepts the dispatch.,no,Adapter receipt is accepted on the current attempt fence,AdapterReceiptCheckpoint(transportAcceptanceState = accepted),AdapterReceiptCheckpoint,,,"phase-6-the-pharmacy-loop.md#6D Referral pack composer, dispatch adapters, and transport contract",
SM_PHARMACY_DISPATCH_STATUS__TRANSPORT_ACCEPTED__PROVIDER_ACCEPTED,SM_PHARMACY_DISPATCH_STATUS,PharmacyDispatchAttempt.status,pharmacy,phase_6_pharmacy_loop,settlement,transport_accepted,provider_accepted,Provider-side acceptance is observed.,no,"Provider acceptance binds to the same package, provider, and outbound reference set",AdapterReceiptCheckpoint(providerAcceptanceState = accepted),AdapterReceiptCheckpoint,,,"phase-6-the-pharmacy-loop.md#6D Referral pack composer, dispatch adapters, and transport contract",
SM_PHARMACY_DISPATCH_STATUS__PROVIDER_ACCEPTED__PROOF_PENDING,SM_PHARMACY_DISPATCH_STATUS,PharmacyDispatchAttempt.status,pharmacy,phase_6_pharmacy_loop,settlement,provider_accepted,proof_pending,Provider accepted the request but authoritative dispatch proof is still pending.,no,Active transport assurance profile still requires more proof,PharmacyDispatchAttempt(status = proof_pending); ExternalConfirmationGate,ExternalConfirmationGate,,,"phase-0-the-foundation-protocol.md#Pharmacy dispatch truth; phase-6-the-pharmacy-loop.md#6D Referral pack composer, dispatch adapters, and transport contract",
