transition_id,machine_id,canonical_name,machine_family,phase_tags,state_axis_type,from_state,to_state,trigger,coordinator_owned,guards,authoritative_proofs,related_objects,degraded_posture,closure_blocker_interactions,source_refs,notes
SM_SESSION_STATE__STEP_UP_REQUIRED__ACTIVE,SM_SESSION_STATE,Session.sessionState,canonical_shared_control,phase_0_foundation; phase_2_identity_and_echoes,identity,step_up_required,active,Step-up succeeds under the current session epoch and binding version.,no,Same session fence and route tuple remain current,SessionEstablishmentDecision; Session(sessionState = active),SessionEstablishmentDecision; RouteIntentBinding,,,phase-0-the-foundation-protocol.md; forensic-audit-findings.md,
SM_SESSION_STATE__ACTIVE__RESTRICTED,SM_SESSION_STATE,Session.sessionState,canonical_shared_control,phase_0_foundation; phase_2_identity_and_echoes,identity,active,restricted,Policy or release posture narrows the session to restricted interaction.,no,Writable authority is no longer legal on the live tuple,ReleaseRecoveryDisposition; Session(sessionState = restricted),AudienceSurfaceRuntimeBinding; ReleaseRecoveryDisposition,read_only,,phase-0-the-foundation-protocol.md; forensic-audit-findings.md,
SM_SESSION_STATE__RESTRICTED__RECOVERY_ONLY,SM_SESSION_STATE,Session.sessionState,canonical_shared_control,phase_0_foundation; phase_2_identity_and_echoes,identity,restricted,recovery_only,Session continuity drifts beyond read-only restrictions and requires recovery.,no,Tuple or subject drift invalidates the bound route posture,RouteIntentBinding(bindingState = recovery_only); Session(sessionState = recovery_only),RouteIntentBinding; AudienceSurfaceRuntimeBinding,recovery_only,,phase-0-the-foundation-protocol.md; forensic-audit-findings.md,
SM_SESSION_STATE__ACTIVE__REVOKED,SM_SESSION_STATE,Session.sessionState,canonical_shared_control,phase_0_foundation; phase_2_identity_and_echoes,identity,active,revoked,"Logout, repair, or supersession revokes the session.",no,Revocation is authoritative on the current session epoch,SessionTerminationSettlement,SessionTerminationSettlement; AccessGrantSupersessionRecord,,,phase-0-the-foundation-protocol.md; forensic-audit-findings.md,
SM_SESSION_STATE__ACTIVE__EXPIRED_IDLE,SM_SESSION_STATE,Session.sessionState,canonical_shared_control,phase_0_foundation; phase_2_identity_and_echoes,identity,active,expired_idle,Idle timeout elapses.,no,Idle expiry threshold has passed,SessionTerminationSettlement,SessionTerminationSettlement,,,phase-0-the-foundation-protocol.md; forensic-audit-findings.md,
SM_SESSION_STATE__ACTIVE__EXPIRED_ABSOLUTE,SM_SESSION_STATE,Session.sessionState,canonical_shared_control,phase_0_foundation; phase_2_identity_and_echoes,identity,active,expired_absolute,Absolute session lifetime elapses.,no,Absolute expiry threshold has passed,SessionTerminationSettlement,SessionTerminationSettlement,,,phase-0-the-foundation-protocol.md; forensic-audit-findings.md,
SM_SESSION_STATE__ACTIVE__TERMINATED,SM_SESSION_STATE,Session.sessionState,canonical_shared_control,phase_0_foundation; phase_2_identity_and_echoes,identity,active,terminated,The session ends for an explicit terminal reason.,no,Termination settlement is authoritative,SessionTerminationSettlement,SessionTerminationSettlement,,,phase-0-the-foundation-protocol.md; forensic-audit-findings.md,
SM_SESSION_ROUTE_AUTHORITY__NONE__AUTH_READ_ONLY,SM_SESSION_ROUTE_AUTHORITY,Session.routeAuthorityState,canonical_shared_control,phase_0_foundation; phase_2_identity_and_echoes,gate,none,auth_read_only,Auth succeeds but writable claim has not been settled.,no,Session is active on the current subject scope,Session(sessionState = active); CapabilityDecision(decisionState = allow),Session; CapabilityDecision,,,phase-0-the-foundation-protocol.md; forensic-audit-findings.md,
SM_SESSION_ROUTE_AUTHORITY__AUTH_READ_ONLY__CLAIM_PENDING,SM_SESSION_ROUTE_AUTHORITY,Session.routeAuthorityState,canonical_shared_control,phase_0_foundation; phase_2_identity_and_echoes,gate,auth_read_only,claim_pending,Claim path or secure continuation is underway.,no,Current grant family permits claim-pending progression,AccessGrantRedemptionRecord; SessionEstablishmentDecision(writableAuthorityState = claim_pending),AccessGrant; SessionEstablishmentDecision,,,phase-0-the-foundation-protocol.md; forensic-audit-findings.md,
SM_SESSION_ROUTE_AUTHORITY__CLAIM_PENDING__WRITABLE,SM_SESSION_ROUTE_AUTHORITY,Session.routeAuthorityState,canonical_shared_control,phase_0_foundation; phase_2_identity_and_echoes,gate,claim_pending,writable,"Current capability, route intent, and publication tuple all permit mutation.",no,Session.sessionState = active; RouteIntentBinding is live; AudienceSurfaceRuntimeBinding is publishable_live,RouteIntentBinding(bindingState = live); AudienceSurfaceRuntimeBinding(bindingState = publishable_live); CapabilityDecision(decisionState = allow),RouteIntentBinding; AudienceSurfaceRuntimeBinding; CapabilityDecision,,,phase-0-the-foundation-protocol.md; forensic-audit-findings.md,
SM_ACCESS_GRANT_LIFECYCLE__LIVE__REDEEMING,SM_ACCESS_GRANT_LIFECYCLE,AccessGrant.grantState,canonical_shared_control,phase_0_foundation; phase_2_identity_and_echoes,lifecycle,live,redeeming,A one-time or rotating grant is presented and redemption begins.,no,"Grant validator, lineage scope, and runtime tuple all still match",AccessGrantRedemptionRecord,AccessGrantScopeEnvelope; RouteIntentBinding,,,phase-0-the-foundation-protocol.md; forensic-audit-findings.md,
SM_ACCESS_GRANT_LIFECYCLE__REDEEMING__REDEEMED,SM_ACCESS_GRANT_LIFECYCLE,AccessGrant.grantState,canonical_shared_control,phase_0_foundation; phase_2_identity_and_echoes,lifecycle,redeeming,redeemed,Redemption settles exactly once and downstream session or continuation creation succeeds.,no,No replay collision exists; Redemption count and scope are still valid,AccessGrantRedemptionRecord; CommandSettlementRecord(authoritativeOutcomeState = settled),CommandSettlementRecord,,,phase-0-the-foundation-protocol.md; forensic-audit-findings.md,
SM_ACCESS_GRANT_LIFECYCLE__LIVE__ROTATED,SM_ACCESS_GRANT_LIFECYCLE,AccessGrant.grantState,canonical_shared_control,phase_0_foundation; phase_2_identity_and_echoes,lifecycle,live,rotated,Grant rotation or reissue begins under the same governed family.,no,Fresh grant issuance is required on a newer tuple,AccessGrantSupersessionRecord,AccessGrantScopeEnvelope,,,phase-0-the-foundation-protocol.md; forensic-audit-findings.md,
SM_ACCESS_GRANT_LIFECYCLE__ROTATED__SUPERSEDED,SM_ACCESS_GRANT_LIFECYCLE,AccessGrant.grantState,canonical_shared_control,phase_0_foundation; phase_2_identity_and_echoes,lifecycle,rotated,superseded,Replacement grant is current and the prior grant is now historical only.,no,Supersession is exact-once and authoritative,AccessGrantSupersessionRecord,AccessGrant,,,phase-0-the-foundation-protocol.md; forensic-audit-findings.md,
SM_ACCESS_GRANT_LIFECYCLE__LIVE__REVOKED,SM_ACCESS_GRANT_LIFECYCLE,AccessGrant.grantState,canonical_shared_control,phase_0_foundation; phase_2_identity_and_echoes,lifecycle,live,revoked,"Grant is explicitly revoked for repair, logout, policy, or abuse reasons.",no,Revocation binds to the current grant family and tuple,AccessGrantSupersessionRecord; GrantRevocationRecord,AccessGrant,,,phase-0-the-foundation-protocol.md; forensic-audit-findings.md,
SM_ACCESS_GRANT_LIFECYCLE__LIVE__EXPIRED,SM_ACCESS_GRANT_LIFECYCLE,AccessGrant.grantState,canonical_shared_control,phase_0_foundation; phase_2_identity_and_echoes,lifecycle,live,expired,Grant expires before legal redemption.,no,Expiry time has passed,AccessGrantExpiryRecord,AccessGrant,,,phase-0-the-foundation-protocol.md; forensic-audit-findings.md,
SM_DUPLICATE_CLUSTER_STATUS__OPEN__IN_REVIEW,SM_DUPLICATE_CLUSTER_STATUS,DuplicateCluster.reviewStatus,canonical_shared_control,phase_0_foundation; phase_1_red_flag_gate; phase_3_human_checkpoint,case_local,open,in_review,Review-required duplicate ambiguity is assigned explicit triage review work.,no,relationType = review_required or same_episode_candidate,DuplicateCluster; request.duplicate.review_required event,DuplicateResolutionDecision,,Duplicate review blocks closure while unresolved,phase-0-the-foundation-protocol.md#1.7 DuplicateCluster; forensic-audit-findings.md#Finding 65 - The event catalogue lacked duplicate-review lifecycle events,
SM_DUPLICATE_CLUSTER_STATUS__IN_REVIEW__RESOLVED_CONFIRMED,SM_DUPLICATE_CLUSTER_STATUS,DuplicateCluster.reviewStatus,canonical_shared_control,phase_0_foundation; phase_1_red_flag_gate; phase_3_human_checkpoint,case_local,in_review,resolved_confirmed,Review confirms same-episode or attach behavior under explicit continuity witness.,no,DecisionClass is exact_retry_collapse or same_episode_link; Winning pair evidence and continuity witness are current,DuplicateResolutionDecision(decisionState = applied),DuplicateResolutionDecision; DuplicatePairEvidence,,,phase-0-the-foundation-protocol.md; forensic-audit-findings.md,
SM_DUPLICATE_CLUSTER_STATUS__IN_REVIEW__RESOLVED_SEPARATE,SM_DUPLICATE_CLUSTER_STATUS,DuplicateCluster.reviewStatus,canonical_shared_control,phase_0_foundation; phase_1_red_flag_gate; phase_3_human_checkpoint,case_local,in_review,resolved_separate,Review confirms the incoming item must remain a separate request.,no,DecisionClass = separate_request,DuplicateResolutionDecision(decisionState = applied),DuplicateResolutionDecision,,,phase-0-the-foundation-protocol.md; forensic-audit-findings.md,
SM_DUPLICATE_CLUSTER_STATUS__IN_REVIEW__RESOLVED_RELATED,SM_DUPLICATE_CLUSTER_STATUS,DuplicateCluster.reviewStatus,canonical_shared_control,phase_0_foundation; phase_1_red_flag_gate; phase_3_human_checkpoint,case_local,in_review,resolved_related,Review confirms related-episode linkage without same-request attachment.,no,DecisionClass = related_episode_link,DuplicateResolutionDecision(decisionState = applied),DuplicateResolutionDecision,,,phase-0-the-foundation-protocol.md; forensic-audit-findings.md,
SM_DUPLICATE_CLUSTER_STATUS__IN_REVIEW__RESOLVED_RETRY,SM_DUPLICATE_CLUSTER_STATUS,DuplicateCluster.reviewStatus,canonical_shared_control,phase_0_foundation; phase_1_red_flag_gate; phase_3_human_checkpoint,case_local,in_review,resolved_retry,Review confirms exact retry collapse.,no,DecisionClass = exact_retry_collapse,DuplicateResolutionDecision(decisionState = applied),DuplicateResolutionDecision,,,phase-0-the-foundation-protocol.md; forensic-audit-findings.md,
SM_DUPLICATE_CLUSTER_STATUS__OPEN__SUPERSEDED,SM_DUPLICATE_CLUSTER_STATUS,DuplicateCluster.reviewStatus,canonical_shared_control,phase_0_foundation; phase_1_red_flag_gate; phase_3_human_checkpoint,case_local,open,superseded,A newer cluster or resolution supersedes the current review container.,no,Superseding cluster or decision exists,DuplicateResolutionDecision(decisionState = superseded),DuplicateResolutionDecision,,,phase-0-the-foundation-protocol.md; forensic-audit-findings.md,
SM_FALLBACK_REVIEW_CASE__DRAFT_RECOVERABLE__SUBMITTED_DEGRADED,SM_FALLBACK_REVIEW_CASE,FallbackReviewCase.patientVisibleState,canonical_shared_control,phase_0_foundation,case_local,draft_recoverable,submitted_degraded,Accepted user progress cannot complete automatically and degrades into governed review.,no,"Automated ingest, safety, or dependency path failed after progress was accepted",FallbackReviewCase; patient.receipt.degraded event,FallbackReviewCase,,Fallback review remains closure-blocking while open,phase-0-the-foundation-protocol.md#1.20 FallbackReviewCase; forensic-audit-findings.md#Finding 62 - The event catalogue lacked degraded receipt events,
SM_FALLBACK_REVIEW_CASE__SUBMITTED_DEGRADED__UNDER_MANUAL_REVIEW,SM_FALLBACK_REVIEW_CASE,FallbackReviewCase.patientVisibleState,canonical_shared_control,phase_0_foundation,case_local,submitted_degraded,under_manual_review,Manual owner picks up degraded accepted progress.,no,Fallback queue ownership exists,exception.review_case.opened event; RequestLifecycleLease,RequestLifecycleLease,,,phase-0-the-foundation-protocol.md; forensic-audit-findings.md,
SM_FALLBACK_REVIEW_CASE__UNDER_MANUAL_REVIEW__RECOVERED,SM_FALLBACK_REVIEW_CASE,FallbackReviewCase.patientVisibleState,canonical_shared_control,phase_0_foundation,case_local,under_manual_review,recovered,Manual review repairs the degraded path without losing lineage.,no,Recovery path is settled on the same lineage,exception.review_case.recovered event,CommandSettlementRecord,,,phase-0-the-foundation-protocol.md; forensic-audit-findings.md,
SM_FALLBACK_REVIEW_CASE__RECOVERED__CLOSED,SM_FALLBACK_REVIEW_CASE,FallbackReviewCase.patientVisibleState,canonical_shared_control,phase_0_foundation,case_local,recovered,closed,Recovered case is acknowledged and no longer blocks closure.,no,Recovery is durable and any downstream blocker has been cleared or superseded,FallbackReviewClosureRecord,RequestClosureRecord,,,phase-0-the-foundation-protocol.md; forensic-audit-findings.md,
SM_REQUEST_LIFECYCLE_LEASE__ACTIVE__RELEASING,SM_REQUEST_LIFECYCLE_LEASE,RequestLifecycleLease.state,canonical_shared_control,phase_0_foundation; phase_3_human_checkpoint; callback_and_messaging; phase_4_booking_engine; phase_5_network_horizon; phase_6_pharmacy_loop,lease,active,releasing,Current owner intentionally releases the lease.,no,Compare-and-set on current ownershipEpoch and fencingToken succeeds,RequestLifecycleLease; LeaseReleaseRecord,StaleOwnershipRecoveryRecord,,"Any active, releasing, expired, or broken lease blocks closure",phase-0-the-foundation-protocol.md; forensic-audit-findings.md,
SM_REQUEST_LIFECYCLE_LEASE__RELEASING__RELEASED,SM_REQUEST_LIFECYCLE_LEASE,RequestLifecycleLease.state,canonical_shared_control,phase_0_foundation; phase_3_human_checkpoint; callback_and_messaging; phase_4_booking_engine; phase_5_network_horizon; phase_6_pharmacy_loop,lease,releasing,released,Release is durably committed or replaced by a newer lease.,no,Replacement lease or release settlement is current,LeaseTakeoverRecord | LeaseReleaseRecord,LeaseTakeoverRecord,,,phase-0-the-foundation-protocol.md; forensic-audit-findings.md,
SM_REQUEST_LIFECYCLE_LEASE__ACTIVE__EXPIRED,SM_REQUEST_LIFECYCLE_LEASE,RequestLifecycleLease.state,canonical_shared_control,phase_0_foundation; phase_3_human_checkpoint; callback_and_messaging; phase_4_booking_engine; phase_5_network_horizon; phase_6_pharmacy_loop,lease,active,expired,Heartbeat misses the TTL.,no,No supervised release or takeover has yet settled,StaleOwnershipRecoveryRecord(recoveryReason = heartbeat_missed),StaleOwnershipRecoveryRecord,stale_owner_recovery,Expired lease remains closure-blocking until recovered,phase-0-the-foundation-protocol.md; forensic-audit-findings.md,
SM_REQUEST_LIFECYCLE_LEASE__ACTIVE__BROKEN,SM_REQUEST_LIFECYCLE_LEASE,RequestLifecycleLease.state,canonical_shared_control,phase_0_foundation; phase_3_human_checkpoint; callback_and_messaging; phase_4_booking_engine; phase_5_network_horizon; phase_6_pharmacy_loop,lease,active,broken,A stale write or supervised takeover breaks the lease.,no,Write fence mismatch or takeover authorization exists,StaleOwnershipRecoveryRecord; LeaseTakeoverRecord,StaleOwnershipRecoveryRecord; LeaseTakeoverRecord,stale_owner_recovery,Broken lease remains closure-blocking until resolved,phase-0-the-foundation-protocol.md; forensic-audit-findings.md,
SM_REQUEST_CLOSURE_DECISION__DEFER__CLOSE,SM_REQUEST_CLOSURE_DECISION,RequestClosureRecord.decision,canonical_shared_control,phase_0_foundation,gate,defer,close,A later coordinator evaluation finds the blocker set empty on the required lineage epoch.,yes,"blockingLeaseRefs, blockingDuplicateClusterRefs, blockingFallbackCaseRefs, blockingIdentityRepairRefs, blockingGrantRefs, blockingReachabilityRefs, blockingConfirmationRefs, and blockingReconciliationRefs are all empty; requiredLineageEpoch matches the current LineageFence",RequestClosureRecord(decision = close); request.closure_blockers.changed -> empty,DuplicateCluster; FallbackReviewCase; IdentityBinding; AccessGrant; ExternalConfirmationGate,,,phase-0-the-foundation-protocol.md#1.12 RequestClosureRecord; forensic-audit-findings.md#Finding 71 - Closure evaluation did not explicitly assert empty coordinator-materialized blocker sets,
SM_CAPACITY_RESERVATION_STATE__NONE__SOFT_SELECTED,SM_CAPACITY_RESERVATION_STATE,CapacityReservation.state,canonical_shared_control,phase_0_foundation; phase_4_booking_engine; phase_5_network_horizon,settlement,none,soft_selected,A candidate is selected but no real exclusivity exists yet.,no,Selection context exists on the current candidate set,OfferSession | AlternativeOfferSession,ReservationTruthProjection,,,phase-0-the-foundation-protocol.md; forensic-audit-findings.md,
SM_CAPACITY_RESERVATION_STATE__SOFT_SELECTED__HELD,SM_CAPACITY_RESERVATION_STATE,CapacityReservation.state,canonical_shared_control,phase_0_foundation; phase_4_booking_engine; phase_5_network_horizon,settlement,soft_selected,held,A true exclusive hold is acquired.,no,CapacityIdentity is strong enough for exclusivity; commitMode = exclusive_hold,CapacityReservation(state = held),ReservationTruthProjection,,,phase-0-the-foundation-protocol.md; forensic-audit-findings.md,
SM_CAPACITY_RESERVATION_STATE__SOFT_SELECTED__PENDING_CONFIRMATION,SM_CAPACITY_RESERVATION_STATE,CapacityReservation.state,canonical_shared_control,phase_0_foundation; phase_4_booking_engine; phase_5_network_horizon,settlement,soft_selected,pending_confirmation,The system is confirming a nonexclusive or weakly-held selection.,no,Visible claim remains truthful and not exclusive,ReservationTruthProjection(truthState = pending_confirmation),ReservationTruthProjection; CommandSettlementRecord,,,phase-0-the-foundation-protocol.md; forensic-audit-findings.md,
SM_CAPACITY_RESERVATION_STATE__HELD__PENDING_CONFIRMATION,SM_CAPACITY_RESERVATION_STATE,CapacityReservation.state,canonical_shared_control,phase_0_foundation; phase_4_booking_engine; phase_5_network_horizon,settlement,held,pending_confirmation,Commit begins and waits for authoritative booking confirmation.,no,Current reservation version remains live,BookingTransaction; ReservationTruthProjection(truthState = pending_confirmation),BookingTransaction; ReservationTruthProjection,,,phase-0-the-foundation-protocol.md; forensic-audit-findings.md,
SM_CAPACITY_RESERVATION_STATE__PENDING_CONFIRMATION__CONFIRMED,SM_CAPACITY_RESERVATION_STATE,CapacityReservation.state,canonical_shared_control,phase_0_foundation; phase_4_booking_engine; phase_5_network_horizon,settlement,pending_confirmation,confirmed,Authoritative confirmation lands for the same reservation lineage.,no,External confirmation gate or strong proof is satisfied,BookingConfirmationTruthProjection(confirmationTruthState = confirmed),ExternalConfirmationGate; BookingConfirmationTruthProjection,,,phase-0-the-foundation-protocol.md; forensic-audit-findings.md,
SM_CAPACITY_RESERVATION_STATE__HELD__RELEASED,SM_CAPACITY_RESERVATION_STATE,CapacityReservation.state,canonical_shared_control,phase_0_foundation; phase_4_booking_engine; phase_5_network_horizon,settlement,held,released,The hold is intentionally released.,no,Supersession or cancellation reason is current,CapacityReservation(releasedAt != null),ReservationTruthProjection,,,phase-0-the-foundation-protocol.md; forensic-audit-findings.md,
SM_CAPACITY_RESERVATION_STATE__HELD__EXPIRED,SM_CAPACITY_RESERVATION_STATE,CapacityReservation.state,canonical_shared_control,phase_0_foundation; phase_4_booking_engine; phase_5_network_horizon,settlement,held,expired,A real hold TTL expires.,no,expiresAt has passed,CapacityReservation(state = expired),ReservationTruthProjection,,,phase-0-the-foundation-protocol.md; forensic-audit-findings.md,
SM_CAPACITY_RESERVATION_STATE__PENDING_CONFIRMATION__DISPUTED,SM_CAPACITY_RESERVATION_STATE,CapacityReservation.state,canonical_shared_control,phase_0_foundation; phase_4_booking_engine; phase_5_network_horizon,settlement,pending_confirmation,disputed,Confirmation evidence becomes contradictory or stale on the same reservation version.,no,Reservation truth-basis check fails or competing evidence exists,ReservationTruthProjection(truthState = disputed); ExternalConfirmationGate(state = disputed),ReservationTruthProjection; ExternalConfirmationGate,,,phase-0-the-foundation-protocol.md; forensic-audit-findings.md,
SM_EXTERNAL_CONFIRMATION_GATE__PENDING__CONFIRMED,SM_EXTERNAL_CONFIRMATION_GATE,ExternalConfirmationGate.state,canonical_shared_control,phase_0_foundation; phase_4_booking_engine; phase_5_network_horizon; phase_6_pharmacy_loop,gate,pending,confirmed,Required hard matches pass and corroboration reaches the confirmation threshold.,no,Every required hard match passes; Weak/manual paths have corroboration from at least two source families,confirmation.gate.confirmed event; GateEvidenceBundle,BookingTransaction; HubCommitAttempt; PharmacyDispatchAttempt,,,phase-0-the-foundation-protocol.md; forensic-audit-findings.md,
SM_EXTERNAL_CONFIRMATION_GATE__PENDING__EXPIRED,SM_EXTERNAL_CONFIRMATION_GATE,ExternalConfirmationGate.state,canonical_shared_control,phase_0_foundation; phase_4_booking_engine; phase_5_network_horizon; phase_6_pharmacy_loop,gate,pending,expired,The confirmation deadline passes without sufficient corroboration.,no,confirmationDeadlineAt is reached before confirmation threshold,confirmation.gate.expired event,BookingCase; HubCoordinationCase; PharmacyCase,reconciliation_required,Gate remains a closure blocker until reviewed or superseded,phase-0-the-foundation-protocol.md; forensic-audit-findings.md,
SM_EXTERNAL_CONFIRMATION_GATE__PENDING__DISPUTED,SM_EXTERNAL_CONFIRMATION_GATE,ExternalConfirmationGate.state,canonical_shared_control,phase_0_foundation; phase_4_booking_engine; phase_5_network_horizon; phase_6_pharmacy_loop,gate,pending,disputed,Contradictory evidence or competing gates prevent safe confirmation.,no,"Hard-match failure, contradictory evidence, or competing-gate ambiguity exists",confirmation.gate.disputed event; NegativeEvidenceBundle,BookingCase; HubCoordinationCase; PharmacyDispatchAttempt,review_required,Gate remains a closure blocker until resolved or downgraded under policy,phase-0-the-foundation-protocol.md; forensic-audit-findings.md,
SM_EXTERNAL_CONFIRMATION_GATE__PENDING__CANCELLED,SM_EXTERNAL_CONFIRMATION_GATE,ExternalConfirmationGate.state,canonical_shared_control,phase_0_foundation; phase_4_booking_engine; phase_5_network_horizon; phase_6_pharmacy_loop,gate,pending,cancelled,The owning branch is cancelled or superseded before confirmation completes.,no,Owning branch has a newer authoritative attempt or termination reason,confirmation.gate.cancelled event,BookingTransaction; HubCommitAttempt; PharmacyDispatchAttempt,,,phase-0-the-foundation-protocol.md; forensic-audit-findings.md,
SM_ROUTE_INTENT_BINDING__LIVE__STALE,SM_ROUTE_INTENT_BINDING,RouteIntentBinding.bindingState,canonical_shared_control,phase_0_foundation; all_live_routes,gate,live,stale,"Session, subject binding, manifest, or release tuple drifts from the bound target tuple.",no,Current authoritative tuple no longer matches routeIntentTupleHash,RouteIntentDriftAssessment; ReleaseRecoveryDisposition,Session; AudienceSurfaceRuntimeBinding,same-shell stale_recoverable,,phase-0-the-foundation-protocol.md; forensic-audit-findings.md,
SM_ROUTE_INTENT_BINDING__STALE__RECOVERY_ONLY,SM_ROUTE_INTENT_BINDING,RouteIntentBinding.bindingState,canonical_shared_control,phase_0_foundation; all_live_routes,gate,stale,recovery_only,A stale route can no longer safely remain writable or read-only under the old tuple.,no,Fresh explicit disambiguation or reissue is still pending,RouteIntentBinding(bindingState = recovery_only),CommandSettlementRecord,recovery_only,,phase-0-the-foundation-protocol.md; forensic-audit-findings.md,
SM_ROUTE_INTENT_BINDING__LIVE__SUPERSEDED,SM_ROUTE_INTENT_BINDING,RouteIntentBinding.bindingState,canonical_shared_control,phase_0_foundation; all_live_routes,gate,live,superseded,A new route intent replaces the prior tuple.,no,Replacement route intent is authoritative,RouteIntentSupersessionRecord,CommandActionRecord,,,phase-0-the-foundation-protocol.md; forensic-audit-findings.md,
SM_COMMAND_SETTLEMENT__PENDING__PROJECTION_PENDING,SM_COMMAND_SETTLEMENT,CommandSettlementRecord.authoritativeOutcomeState,canonical_shared_control,phase_0_foundation; all_live_routes,settlement,pending,projection_pending,Command applied but downstream projection visibility has not yet caught up.,no,Action record is immutable and current,CommandSettlementRecord(result = projection_pending),CommandActionRecord,,,phase-0-the-foundation-protocol.md; forensic-audit-findings.md,
SM_COMMAND_SETTLEMENT__PENDING__AWAITING_EXTERNAL,SM_COMMAND_SETTLEMENT,CommandSettlementRecord.authoritativeOutcomeState,canonical_shared_control,phase_0_foundation; all_live_routes,settlement,pending,awaiting_external,External evidence or acceptance is required before settlement can calm down.,no,The same action chain is still live,CommandSettlementRecord(result = awaiting_external),ExternalConfirmationGate,,,phase-0-the-foundation-protocol.md; forensic-audit-findings.md,
SM_COMMAND_SETTLEMENT__PENDING__REVIEW_REQUIRED,SM_COMMAND_SETTLEMENT,CommandSettlementRecord.authoritativeOutcomeState,canonical_shared_control,phase_0_foundation; all_live_routes,settlement,pending,review_required,Authoritative review is required before safe completion.,no,Review reason is authoritative,CommandSettlementRecord(result = review_required),ApprovalCheckpoint; DuplicateCluster,,,phase-0-the-foundation-protocol.md; forensic-audit-findings.md,
