transition_id,machine_id,canonical_name,machine_family,phase_tags,state_axis_type,from_state,to_state,trigger,coordinator_owned,guards,authoritative_proofs,related_objects,degraded_posture,closure_blocker_interactions,source_refs,notes
SM_COMMAND_SETTLEMENT__PENDING__STALE_RECOVERABLE,SM_COMMAND_SETTLEMENT,CommandSettlementRecord.authoritativeOutcomeState,canonical_shared_control,phase_0_foundation; all_live_routes,settlement,pending,stale_recoverable,The bound tuple or context has drifted but same-shell recovery is still legal.,no,sameShellRecoveryRef exists,CommandSettlementRecord(result = stale_recoverable),RouteIntentBinding; ReleaseRecoveryDisposition,same-shell recovery,,phase-0-the-foundation-protocol.md; forensic-audit-findings.md,
SM_COMMAND_SETTLEMENT__AWAITING_EXTERNAL__RECONCILIATION_REQUIRED,SM_COMMAND_SETTLEMENT,CommandSettlementRecord.authoritativeOutcomeState,canonical_shared_control,phase_0_foundation; all_live_routes,settlement,awaiting_external,reconciliation_required,External evidence is contradictory or insufficient for calm final truth.,no,Current external evidence cannot settle the same action chain,CommandSettlementRecord(result = reconciliation_required),ExternalConfirmationGate,reconciliation review,,phase-0-the-foundation-protocol.md; forensic-audit-findings.md,
SM_COMMAND_SETTLEMENT__PROJECTION_PENDING__SETTLED,SM_COMMAND_SETTLEMENT,CommandSettlementRecord.authoritativeOutcomeState,canonical_shared_control,phase_0_foundation; all_live_routes,settlement,projection_pending,settled,Projection visibility and authoritative proof converge on the same action chain.,no,authoritativeProofClass is sufficient; Any required command-following projection is current,CommandSettlementRecord(authoritativeOutcomeState = settled),TransitionEnvelope,,,phase-0-the-foundation-protocol.md; forensic-audit-findings.md,
SM_COMMAND_SETTLEMENT__AWAITING_EXTERNAL__SETTLED,SM_COMMAND_SETTLEMENT,CommandSettlementRecord.authoritativeOutcomeState,canonical_shared_control,phase_0_foundation; all_live_routes,settlement,awaiting_external,settled,External proof settles the same action chain authoritatively.,no,authoritativeProofClass is external_confirmation | review_disposition | recovery_disposition,CommandSettlementRecord(authoritativeOutcomeState = settled),ExternalConfirmationGate; TransitionEnvelope,,,phase-0-the-foundation-protocol.md; forensic-audit-findings.md,
SM_COMMAND_SETTLEMENT__REVIEW_REQUIRED__RECOVERY_REQUIRED,SM_COMMAND_SETTLEMENT,CommandSettlementRecord.authoritativeOutcomeState,canonical_shared_control,phase_0_foundation; all_live_routes,settlement,review_required,recovery_required,Review outcome proves the route can only continue through bounded recovery.,no,sameShellRecoveryRef is authoritative,CommandSettlementRecord(authoritativeOutcomeState = recovery_required),ReleaseRecoveryDisposition,,,phase-0-the-foundation-protocol.md; forensic-audit-findings.md,
SM_COMMAND_SETTLEMENT__RECONCILIATION_REQUIRED__SETTLED,SM_COMMAND_SETTLEMENT,CommandSettlementRecord.authoritativeOutcomeState,canonical_shared_control,phase_0_foundation; all_live_routes,settlement,reconciliation_required,settled,Reconciliation resolves the same action chain under the current tuple.,no,Supersession has not moved the action onto a new chain,CommandSettlementRecord(authoritativeOutcomeState = settled),ExternalConfirmationGate,,,phase-0-the-foundation-protocol.md; forensic-audit-findings.md,
SM_COMMAND_SETTLEMENT__PENDING__FAILED,SM_COMMAND_SETTLEMENT,CommandSettlementRecord.authoritativeOutcomeState,canonical_shared_control,phase_0_foundation; all_live_routes,settlement,pending,failed,Authoritative failure settles on the same action chain.,no,"Failure is authoritative, not just local acknowledgement",CommandSettlementRecord(authoritativeOutcomeState = failed),CommandActionRecord,,,phase-0-the-foundation-protocol.md; forensic-audit-findings.md,
SM_COMMAND_SETTLEMENT__PENDING__EXPIRED,SM_COMMAND_SETTLEMENT,CommandSettlementRecord.authoritativeOutcomeState,canonical_shared_control,phase_0_foundation; all_live_routes,settlement,pending,expired,The command-following freshness deadline expires without safe settlement.,no,staleAfterAt passes,CommandSettlementRecord(authoritativeOutcomeState = expired),TransitionEnvelope,,,phase-0-the-foundation-protocol.md; forensic-audit-findings.md,
SM_COMMAND_SETTLEMENT__SETTLED__SUPERSEDED,SM_COMMAND_SETTLEMENT,CommandSettlementRecord.authoritativeOutcomeState,canonical_shared_control,phase_0_foundation; all_live_routes,settlement,settled,superseded,A later settlement revision or superseding action replaces the prior calm state.,no,supersedesSettlementRef exists,CommandSettlementRecord(authoritativeOutcomeState = superseded),CommandActionRecord,,,phase-0-the-foundation-protocol.md; forensic-audit-findings.md,
SM_AUDIENCE_SURFACE_RUNTIME_BINDING__PUBLISHABLE_LIVE__READ_ONLY,SM_AUDIENCE_SURFACE_RUNTIME_BINDING,AudienceSurfaceRuntimeBinding.bindingState,canonical_shared_control,phase_0_foundation; cross_phase_runtime,publication,publishable_live,read_only,The current route remains visible but no longer safely writable.,no,Publication tuple is no longer exact for writable posture,AudienceSurfaceRuntimeBinding(bindingState = read_only); ReleaseRecoveryDisposition,ReleaseRecoveryDisposition; DesignContractPublicationBundle,same-shell read_only,,phase-0-the-foundation-protocol.md; forensic-audit-findings.md,
SM_AUDIENCE_SURFACE_RUNTIME_BINDING__PUBLISHABLE_LIVE__RECOVERY_ONLY,SM_AUDIENCE_SURFACE_RUNTIME_BINDING,AudienceSurfaceRuntimeBinding.bindingState,canonical_shared_control,phase_0_foundation; cross_phase_runtime,publication,publishable_live,recovery_only,"Publication, parity, or continuity drift requires same-shell recovery.",no,surfaceTupleHash no longer matches current runtime truth,AudienceSurfaceRuntimeBinding(bindingState = recovery_only); ReleaseRecoveryDisposition,ReleaseRecoveryDisposition; ExperienceContinuityControlEvidence,same-shell recovery,,phase-0-the-foundation-protocol.md; forensic-audit-findings.md,
SM_AUDIENCE_SURFACE_RUNTIME_BINDING__PUBLISHABLE_LIVE__BLOCKED,SM_AUDIENCE_SURFACE_RUNTIME_BINDING,AudienceSurfaceRuntimeBinding.bindingState,canonical_shared_control,phase_0_foundation; cross_phase_runtime,publication,publishable_live,blocked,"Trust, publication, or freeze posture blocks even read-only safe operation.",no,surfaceAuthorityState is blocked or required trust is not legal,ReleaseTrustFreezeVerdict; AudienceSurfaceRuntimeBinding(bindingState = blocked),ReleaseTrustFreezeVerdict,blocked,,phase-0-the-foundation-protocol.md; forensic-audit-findings.md,
SM_AUDIENCE_SURFACE_RUNTIME_BINDING__READ_ONLY__PUBLISHABLE_LIVE,SM_AUDIENCE_SURFACE_RUNTIME_BINDING,AudienceSurfaceRuntimeBinding.bindingState,canonical_shared_control,phase_0_foundation; cross_phase_runtime,publication,read_only,publishable_live,Exact publication parity and trust posture are restored.,no,coverageState = exact; designContractState = exact; surface authority returns to live,AudienceSurfaceRuntimeBinding(bindingState = publishable_live); ReleasePublicationParityRecord,ReleasePublicationParityRecord,,,phase-0-the-foundation-protocol.md; forensic-audit-findings.md,
SM_AUDIENCE_SURFACE_RUNTIME_BINDING__RECOVERY_ONLY__PUBLISHABLE_LIVE,SM_AUDIENCE_SURFACE_RUNTIME_BINDING,AudienceSurfaceRuntimeBinding.bindingState,canonical_shared_control,phase_0_foundation; cross_phase_runtime,publication,recovery_only,publishable_live,Recovery path revalidates the route tuple and publication parity.,no,Required continuity evidence and publication tuple are current again,AudienceSurfaceRuntimeBinding(bindingState = publishable_live); ExperienceContinuityControlEvidence,ExperienceContinuityControlEvidence; ReleasePublicationParityRecord,,,phase-0-the-foundation-protocol.md; forensic-audit-findings.md,
SM_TRIAGE_TASK_STATUS__QUEUED__CLAIMED,SM_TRIAGE_TASK_STATUS,TriageTask.status,triage_human_checkpoint,phase_3_human_checkpoint,case_local,queued,claimed,Reviewer acquires the current triage lease.,no,RequestLifecycleLease is current; Workspace trust and publication posture remain writable,RequestLifecycleLease; ReviewActionLease,RequestLifecycleLease; AudienceSurfaceRuntimeBinding,,,phase-3-the-human-checkpoint.md#3A Triage contract and workspace state model; forensic-audit-findings.md#Finding 15 - Task claim and lease semantics were absent,
SM_TRIAGE_TASK_STATUS__CLAIMED__IN_REVIEW,SM_TRIAGE_TASK_STATUS,TriageTask.status,triage_human_checkpoint,phase_3_human_checkpoint,case_local,claimed,in_review,The reviewer starts active review on the current review version.,no,reviewVersion and route intent still match,ReviewSession; ReviewActionLease,ReviewSession; DecisionEpoch,,,phase-3-the-human-checkpoint.md#3A Triage contract and workspace state model,
SM_TRIAGE_TASK_STATUS__IN_REVIEW__AWAITING_PATIENT_INFO,SM_TRIAGE_TASK_STATUS,TriageTask.status,triage_human_checkpoint,phase_3_human_checkpoint,case_local,in_review,awaiting_patient_info,Structured more-info request is issued.,no,Exactly one current MoreInfoReplyWindowCheckpoint is live,MoreInfoCycle; MoreInfoReplyWindowCheckpoint,MoreInfoReplyWindowCheckpoint; RequestLifecycleLease,,Open more-info window blocks request closure,"phase-3-the-human-checkpoint.md#3D More-info loop, patient response threading, and re-safety",
SM_TRIAGE_TASK_STATUS__AWAITING_PATIENT_INFO__REVIEW_RESUMED,SM_TRIAGE_TASK_STATUS,TriageTask.status,triage_human_checkpoint,phase_3_human_checkpoint,case_local,awaiting_patient_info,review_resumed,An accepted reply is assimilated and re-safety clears the case back to triage review.,no,MoreInfoResponseDisposition is accepted; Re-safety no longer requires urgent diversion,EvidenceAssimilationRecord; SafetyDecisionRecord; triage.task.resumed event,MoreInfoReplyWindowCheckpoint; SafetyDecisionRecord,,,"phase-3-the-human-checkpoint.md#3D More-info loop, patient response threading, and re-safety",
SM_TRIAGE_TASK_STATUS__REVIEW_RESUMED__QUEUED,SM_TRIAGE_TASK_STATUS,TriageTask.status,triage_human_checkpoint,phase_3_human_checkpoint,case_local,review_resumed,queued,Queue engine re-admits the resumed task under deterministic ranking.,no,Updated ranking explanation is persisted,QueueRankingRecord; triage.task.resumed event,RequestLifecycleLease,,,"phase-3-the-human-checkpoint.md#3D More-info loop, patient response threading, and re-safety",
SM_TRIAGE_TASK_STATUS__IN_REVIEW__ENDPOINT_SELECTED,SM_TRIAGE_TASK_STATUS,TriageTask.status,triage_human_checkpoint,phase_3_human_checkpoint,case_local,in_review,endpoint_selected,Endpoint decision is chosen on the current live DecisionEpoch.,no,Current DecisionEpoch is live and unsuperseded,EndpointDecisionSettlement; DecisionEpoch(epochState = live),DecisionEpoch; EndpointDecisionSettlement,,,phase-3-the-human-checkpoint.md#3E Endpoint decision engine and resolution model,
SM_TRIAGE_TASK_STATUS__ENDPOINT_SELECTED__RESOLVED_WITHOUT_APPOINTMENT,SM_TRIAGE_TASK_STATUS,TriageTask.status,triage_human_checkpoint,phase_3_human_checkpoint,case_local,endpoint_selected,resolved_without_appointment,Direct outcome path settles on the same DecisionEpoch.,no,EndpointDecisionSettlement is settled; Any required approval checkpoint is approved,EndpointDecisionSettlement; ApprovalCheckpoint,ApprovalCheckpoint; CommandSettlementRecord,,,"phase-3-the-human-checkpoint.md#3G Direct resolution, downstream handoff seeds, and reopen mechanics",
SM_TRIAGE_TASK_STATUS__ENDPOINT_SELECTED__HANDOFF_PENDING,SM_TRIAGE_TASK_STATUS,TriageTask.status,triage_human_checkpoint,phase_3_human_checkpoint,case_local,endpoint_selected,handoff_pending,Booking or pharmacy handoff seed is durably created from the current DecisionEpoch.,no,LineageCaseLink(caseFamily) is proposed on the current lineage; Downstream seed references the unsuperseded DecisionEpoch,BookingIntent | PharmacyIntent; LineageCaseLink,DecisionEpoch; LineageCaseLink,,,"phase-3-the-human-checkpoint.md#3G Direct resolution, downstream handoff seeds, and reopen mechanics",
SM_TRIAGE_TASK_STATUS__ENDPOINT_SELECTED__ESCALATED,SM_TRIAGE_TASK_STATUS,TriageTask.status,triage_human_checkpoint,phase_3_human_checkpoint,case_local,endpoint_selected,escalated,Urgent escalation path opens for high-risk review.,no,Urgent escalation or SafetyDecisionRecord requires it,DutyEscalationRecord; SafetyDecisionRecord,DecisionEpoch; Request.safetyState,,,phase-3-the-human-checkpoint.md#3F Human approval checkpoint and urgent escalation path,
SM_TRIAGE_TASK_STATUS__ESCALATED__RESOLVED_WITHOUT_APPOINTMENT,SM_TRIAGE_TASK_STATUS,TriageTask.status,triage_human_checkpoint,phase_3_human_checkpoint,case_local,escalated,resolved_without_appointment,Urgent path settles a direct outcome.,no,DecisionEpoch is still current,DutyEscalationRecord; EndpointDecisionSettlement,DecisionEpoch,,,phase-3-the-human-checkpoint.md#3F Human approval checkpoint and urgent escalation path,
SM_TRIAGE_TASK_STATUS__ESCALATED__HANDOFF_PENDING,SM_TRIAGE_TASK_STATUS,TriageTask.status,triage_human_checkpoint,phase_3_human_checkpoint,case_local,escalated,handoff_pending,Urgent path requires downstream ownership.,no,Downstream intent still matches the live DecisionEpoch,BookingIntent | PharmacyIntent; LineageCaseLink,DecisionEpoch; LineageCaseLink,,,phase-3-the-human-checkpoint.md#3F Human approval checkpoint and urgent escalation path,
SM_TRIAGE_TASK_STATUS__ESCALATED__REOPENED,SM_TRIAGE_TASK_STATUS,TriageTask.status,triage_human_checkpoint,phase_3_human_checkpoint,case_local,escalated,reopened,Urgent path returns the case for further practice review.,no,TriageReopenRecord is current,TriageReopenRecord,DecisionEpoch,,,phase-3-the-human-checkpoint.md#3F Human approval checkpoint and urgent escalation path,
SM_TRIAGE_TASK_STATUS__RESOLVED_WITHOUT_APPOINTMENT__CLOSED,SM_TRIAGE_TASK_STATUS,TriageTask.status,triage_human_checkpoint,phase_3_human_checkpoint,case_local,resolved_without_appointment,closed,All direct-resolution artifacts are durably queued or created.,no,TaskCompletionSettlementEnvelope is settled,TaskCompletionSettlementEnvelope; CommandSettlementRecord(authoritativeOutcomeState = settled),CommandSettlementRecord,,,"phase-3-the-human-checkpoint.md#3G Direct resolution, downstream handoff seeds, and reopen mechanics",
SM_TRIAGE_TASK_STATUS__HANDOFF_PENDING__CLOSED,SM_TRIAGE_TASK_STATUS,TriageTask.status,triage_human_checkpoint,phase_3_human_checkpoint,case_local,handoff_pending,closed,Downstream ownership acknowledges the handoff and the triage branch has no further open work.,no,LineageCaseLink is acknowledged; No triage-side blocker remains,LineageCaseLink; TaskCompletionSettlementEnvelope,LineageCaseLink,,,"phase-3-the-human-checkpoint.md#3G Direct resolution, downstream handoff seeds, and reopen mechanics",
SM_TRIAGE_TASK_STATUS__REOPENED__QUEUED,SM_TRIAGE_TASK_STATUS,TriageTask.status,triage_human_checkpoint,phase_3_human_checkpoint,case_local,reopened,queued,Reopened work re-enters the deterministic queue with raised urgency carry.,no,Fresh triage-side lease is acquired,TriageReopenRecord; QueueRankingRecord,RequestLifecycleLease,,,"phase-3-the-human-checkpoint.md#3G Direct resolution, downstream handoff seeds, and reopen mechanics",
SM_DECISION_EPOCH__LIVE__BLOCKED,SM_DECISION_EPOCH,DecisionEpoch.epochState,triage_human_checkpoint,phase_3_human_checkpoint,gate,live,blocked,The epoch remains current but actionability is temporarily blocked by approval or trust posture.,no,Current HumanApprovalGateAssessment or AssistiveCapabilityTrustEnvelope blocks consequence-bearing submit,EndpointDecisionSettlement(result = blocked_approval_gate),ApprovalCheckpoint; AssistiveCapabilityTrustEnvelope,,,phase-3-the-human-checkpoint.md#3E Endpoint decision engine and resolution model,
SM_DECISION_EPOCH__LIVE__SUPERSEDED,SM_DECISION_EPOCH,DecisionEpoch.epochState,triage_human_checkpoint,phase_3_human_checkpoint,gate,live,superseded,"Evidence, safety, duplicate, policy, trust, publication, or ownership drift requires a replacement epoch.",no,DecisionSupersessionRecord reasonClass is authoritative,DecisionSupersessionRecord,DecisionSupersessionRecord; ApprovalCheckpoint,,,phase-3-the-human-checkpoint.md#3E Endpoint decision engine and resolution model,
SM_APPROVAL_CHECKPOINT__NOT_REQUIRED__REQUIRED,SM_APPROVAL_CHECKPOINT,ApprovalCheckpoint.state,triage_human_checkpoint,phase_3_human_checkpoint,gate,not_required,required,The current consequence requires explicit human approval.,no,Policy bundle marks the decision as irreversible or approval-burdened,ApprovalRequirementAssessment,DecisionEpoch,,,phase-3-the-human-checkpoint.md#3F Human approval checkpoint and urgent escalation path,
SM_APPROVAL_CHECKPOINT__REQUIRED__PENDING,SM_APPROVAL_CHECKPOINT,ApprovalCheckpoint.state,triage_human_checkpoint,phase_3_human_checkpoint,gate,required,pending,Approval request is formally issued for the current DecisionEpoch.,no,DecisionEpoch is live and current,ApprovalCheckpoint(state = pending),DecisionEpoch,,,phase-3-the-human-checkpoint.md#3F Human approval checkpoint and urgent escalation path,
SM_APPROVAL_CHECKPOINT__PENDING__APPROVED,SM_APPROVAL_CHECKPOINT,ApprovalCheckpoint.state,triage_human_checkpoint,phase_3_human_checkpoint,gate,pending,approved,Approver settles the current checkpoint positively.,no,Checkpoint still matches the live DecisionEpoch,ApprovalDecisionRecord(result = approved),DecisionEpoch,,,phase-3-the-human-checkpoint.md#3F Human approval checkpoint and urgent escalation path,
SM_APPROVAL_CHECKPOINT__PENDING__REJECTED,SM_APPROVAL_CHECKPOINT,ApprovalCheckpoint.state,triage_human_checkpoint,phase_3_human_checkpoint,gate,pending,rejected,Approver rejects the current consequence path.,no,Checkpoint still matches the live DecisionEpoch,ApprovalDecisionRecord(result = rejected),DecisionEpoch,,,phase-3-the-human-checkpoint.md#3F Human approval checkpoint and urgent escalation path,
SM_APPROVAL_CHECKPOINT__PENDING__SUPERSEDED,SM_APPROVAL_CHECKPOINT,ApprovalCheckpoint.state,triage_human_checkpoint,phase_3_human_checkpoint,gate,pending,superseded,Any material change invalidates the prior approval basis.,no,DecisionSupersessionRecord exists for the bound epoch,DecisionSupersessionRecord,DecisionEpoch,,,phase-3-the-human-checkpoint.md#3F Human approval checkpoint and urgent escalation path,
SM_MORE_INFO_REPLY_WINDOW__OPEN__REMINDER_DUE,SM_MORE_INFO_REPLY_WINDOW,MoreInfoReplyWindowCheckpoint.replyWindowState,triage_human_checkpoint,phase_3_human_checkpoint,case_local,open,reminder_due,The due-state crosses into reminder cadence under the same checkpoint revision.,no,Current checkpoint remains the sole active window on the lineage,MoreInfoReplyWindowCheckpoint; MoreInfoReminderSchedule,MoreInfoCycle; MoreInfoReminderSchedule,,Open or reminder_due checkpoints block closure,"phase-3-the-human-checkpoint.md#3D More-info loop, patient response threading, and re-safety",
SM_MORE_INFO_REPLY_WINDOW__REMINDER_DUE__LATE_REVIEW,SM_MORE_INFO_REPLY_WINDOW,MoreInfoReplyWindowCheckpoint.replyWindowState,triage_human_checkpoint,phase_3_human_checkpoint,case_local,reminder_due,late_review,The formal reply window closes but late-review grace remains open.,no,Current checkpoint revision is still live,MoreInfoReplyWindowCheckpoint(replyWindowState = late_review),MoreInfoCycle,,late_review remains a closure blocker,"phase-3-the-human-checkpoint.md#3D More-info loop, patient response threading, and re-safety",
SM_MORE_INFO_REPLY_WINDOW__OPEN__SETTLED,SM_MORE_INFO_REPLY_WINDOW,MoreInfoReplyWindowCheckpoint.replyWindowState,triage_human_checkpoint,phase_3_human_checkpoint,case_local,open,settled,Accepted in-window reply is assimilated and the cycle settles.,no,MoreInfoResponseDisposition = accepted_in_window; Evidence assimilation and safety settlement are complete,MoreInfoResponseDisposition; EvidenceAssimilationRecord; SafetyDecisionRecord,EvidenceAssimilationRecord; MoreInfoResponseDisposition,,,"phase-3-the-human-checkpoint.md#3D More-info loop, patient response threading, and re-safety",
SM_MORE_INFO_REPLY_WINDOW__LATE_REVIEW__SETTLED,SM_MORE_INFO_REPLY_WINDOW,MoreInfoReplyWindowCheckpoint.replyWindowState,triage_human_checkpoint,phase_3_human_checkpoint,case_local,late_review,settled,Accepted late review is explicitly assimilated and settled.,no,MoreInfoResponseDisposition = accepted_late_review; Request closure has not yet settled,MoreInfoResponseDisposition; EvidenceAssimilationRecord; SafetyDecisionRecord,EvidenceAssimilationRecord,,,"phase-3-the-human-checkpoint.md#3D More-info loop, patient response threading, and re-safety",
SM_MORE_INFO_REPLY_WINDOW__LATE_REVIEW__EXPIRED,SM_MORE_INFO_REPLY_WINDOW,MoreInfoReplyWindowCheckpoint.replyWindowState,triage_human_checkpoint,phase_3_human_checkpoint,case_local,late_review,expired,Late-review grace elapses without accepted reply assimilation.,no,Checkpoint remains current and unassimilated,MoreInfoReplyWindowCheckpoint(replyWindowState = expired),MoreInfoCycle,,,"phase-3-the-human-checkpoint.md#3D More-info loop, patient response threading, and re-safety",
SM_MORE_INFO_REPLY_WINDOW__OPEN__SUPERSEDED,SM_MORE_INFO_REPLY_WINDOW,MoreInfoReplyWindowCheckpoint.replyWindowState,triage_human_checkpoint,phase_3_human_checkpoint,case_local,open,superseded,A replacement cycle explicitly supersedes the prior one.,no,A newer MoreInfoCycle is current on the lineage,MoreInfoReplyWindowCheckpoint(replyWindowState = superseded); GrantRevocationRecord,MoreInfoCycle; AccessGrant,,,"phase-3-the-human-checkpoint.md#3D More-info loop, patient response threading, and re-safety",
SM_MORE_INFO_REPLY_WINDOW__REMINDER_DUE__SUPERSEDED,SM_MORE_INFO_REPLY_WINDOW,MoreInfoReplyWindowCheckpoint.replyWindowState,triage_human_checkpoint,phase_3_human_checkpoint,case_local,reminder_due,superseded,The outstanding loop is replaced by a newer cycle before the patient responds.,no,Replacement cycle is explicitly governed,MoreInfoReplyWindowCheckpoint(replyWindowState = superseded); GrantRevocationRecord,MoreInfoCycle; AccessGrant,,,"phase-3-the-human-checkpoint.md#3D More-info loop, patient response threading, and re-safety",
SM_CALLBACK_CASE_STATE__CREATED__QUEUED,SM_CALLBACK_CASE_STATE,CallbackCase.state,callback_and_messaging,callback_and_messaging; phase_3_human_checkpoint; phase_5_network_horizon,case_local,created,queued,Callback case enters the governed callback queue.,no,LineageCaseLink(caseFamily = callback) exists,CallbackCase; LineageCaseLink,CallbackIntentLease,,,callback-and-clinician-messaging-loop.md#Callback domain,
SM_CALLBACK_CASE_STATE__QUEUED__SCHEDULED,SM_CALLBACK_CASE_STATE,CallbackCase.state,callback_and_messaging,callback_and_messaging; phase_3_human_checkpoint; phase_5_network_horizon,case_local,queued,scheduled,CallbackIntentLease schedules the callback promise window.,no,Current RequestLifecycleLease and CallbackIntentLease fencing still match,CallbackIntentLease; CallbackExpectationEnvelope,CallbackIntentLease; CallbackExpectationEnvelope,,,callback-and-clinician-messaging-loop.md#Callback domain,
SM_CALLBACK_CASE_STATE__SCHEDULED__READY_FOR_ATTEMPT,SM_CALLBACK_CASE_STATE,CallbackCase.state,callback_and_messaging,callback_and_messaging; phase_3_human_checkpoint; phase_5_network_horizon,case_local,scheduled,ready_for_attempt,The current callback window opens and the case is armed for attempt.,no,Expectation window is current; Route and contact posture remain valid,CallbackIntentLease(leaseMode = ready_for_attempt); CallbackExpectationEnvelope,CallbackIntentLease; RouteIntentBinding,,,callback-and-clinician-messaging-loop.md#Callback domain,
SM_CALLBACK_CASE_STATE__READY_FOR_ATTEMPT__ATTEMPT_IN_PROGRESS,SM_CALLBACK_CASE_STATE,CallbackCase.state,callback_and_messaging,callback_and_messaging; phase_3_human_checkpoint; phase_5_network_horizon,case_local,ready_for_attempt,attempt_in_progress,A callback attempt is initiated.,no,Exact attempt fence has not already been used,CallbackAttemptRecord(settlementState = initiated); CommandActionRecord,CallbackAttemptRecord; CommandActionRecord,,,callback-and-clinician-messaging-loop.md#Callback domain,
SM_CALLBACK_CASE_STATE__ATTEMPT_IN_PROGRESS__AWAITING_OUTCOME_EVIDENCE,SM_CALLBACK_CASE_STATE,CallbackCase.state,callback_and_messaging,callback_and_messaging; phase_3_human_checkpoint; phase_5_network_horizon,case_local,attempt_in_progress,awaiting_outcome_evidence,The provider or staff attempt has started but outcome evidence is not yet settled.,no,Attempt fence is still current,CallbackAttemptRecord(settlementState = outcome_pending),CallbackAttemptRecord,,,callback-and-clinician-messaging-loop.md#Callback domain,
SM_CALLBACK_CASE_STATE__AWAITING_OUTCOME_EVIDENCE__ANSWERED,SM_CALLBACK_CASE_STATE,CallbackCase.state,callback_and_messaging,callback_and_messaging; phase_3_human_checkpoint; phase_5_network_horizon,case_local,awaiting_outcome_evidence,answered,Answered outcome evidence lands on the current attempt fence.,no,Outcome bundle is durably stored,CallbackOutcomeEvidenceBundle(outcome = answered),CallbackOutcomeEvidenceBundle,,,callback-and-clinician-messaging-loop.md#Callback domain,
SM_CALLBACK_CASE_STATE__AWAITING_OUTCOME_EVIDENCE__NO_ANSWER,SM_CALLBACK_CASE_STATE,CallbackCase.state,callback_and_messaging,callback_and_messaging; phase_3_human_checkpoint; phase_5_network_horizon,case_local,awaiting_outcome_evidence,no_answer,No-answer evidence settles on the current attempt fence.,no,Outcome bundle is durably stored,CallbackOutcomeEvidenceBundle(outcome = no_answer),CallbackOutcomeEvidenceBundle,,,callback-and-clinician-messaging-loop.md#Callback domain,
