roleId,roleTitle,reviewEventId,responsibility,decisionType,mockOrActualState,requiredInputs,noSelfApprovalBoundary,escalationTargetRole,prerequisiteGapRefs,sourceBlueprintRefs,notes
ROLE_PRODUCT_OWNER,Product Owner,PRIV_REVIEW_SPRINT_DELTA,Owns minimization decisions for product scope and confirms why each processing activity exists.,scope_and_priority,mixed,privacy_threat_register.csv|dpia_backlog.csv,"Cannot singularly close high-risk or actual-production backlog items without privacy, security, and governance concurrence.",ROLE_PRIVACY_LEAD_PLACEHOLDER,,prompt/126.md#Mission|blueprint/blueprint-init.md#Core product framing,Product ownership is necessary for purpose-of-use discipline but is not itself a privacy signoff substitute.
ROLE_ENGINEERING_LEAD,Engineering Lead,PRIV_REVIEW_RUNTIME_AND_DISCLOSURE_CHANGE,"Confirms the runtime, projection, gateway, and telemetry controls are real authorization and disclosure controls rather than cosmetic shell behavior.",technical_control_implementation,mixed,privacy_control_traceability.json|privacy_data_flow_inventory.json,Cannot mark a material privacy risk as closed without independent privacy and release review.,ROLE_SECURITY_LEAD,,blueprint/phase-0-the-foundation-protocol.md#2.8 ScopedMutationGate|blueprint/platform-frontend-blueprint.md#AudienceSurfaceRuntimeBinding,Engineering is accountable for turning visibility and masking rules into enforceable code and tests.
ROLE_PRIVACY_LEAD_PLACEHOLDER,Privacy Lead / DPO Placeholder,PRIV_REVIEW_DPIA_BACKLOG_AND_BREAK_GLASS,"Owns the DPIA-ready backlog, controller or processor questions, transparency obligations, and break-glass review burden.",privacy_governance,mixed,dpia_backlog.csv|privacy_role_and_review_matrix.csv|126_mock_now_vs_actual_privacy_strategy.md,Placeholder role may curate the backlog now but actual production acceptance remains pending named appointment and signoff policy.,ROLE_GOVERNANCE_RELEASE_APPROVER,PREREQUISITE_GAP_125_CLINICAL_SIGNOFF_PACK_PENDING,"prompt/126.md#Actual_production_strategy_later|blueprint/phase-9-the-assurance-ledger.md#9A. Assurance ledger, evidence graph, and operational state contracts",The placeholder remains explicit so actual production signoff does not get implied before the governance model is published.
ROLE_CLINICAL_SAFETY_LEAD,Clinical Safety Lead,PRIV_REVIEW_CLINICAL_AND_PATIENT_IMPACT,"Checks whether privacy drift changes patient-safe flows, wrong-patient repair, break-glass burden, or callback safety posture.",clinical_safety_dependency_review,mixed,data/assurance/dcb0129_hazard_register.json|privacy_threat_register.csv,Clinical safety review is required for high-impact disclosure or wrong-patient scenarios and stays provisional until par_125 outputs are published.,ROLE_GOVERNANCE_RELEASE_APPROVER,PREREQUISITE_GAP_125_CLINICAL_SIGNOFF_PACK_PENDING,blueprint/phase-1-the-red-flag-gate.md#Clinical safety documentation and incremental evidence updates|data/assurance/dcb0129_hazard_register.json#hazards,Privacy and clinical safety are linked where disclosure or repair drift can affect care delivery.
ROLE_SECURITY_LEAD,Security Lead,PRIV_REVIEW_SECURITY_AND_TELEMETRY_SCOPE,"Checks browser-visible diagnostics, secrets adjacency, telemetry masking, transport boundaries, and processor handoff posture.",security_and_transport_review,mixed,privacy_control_traceability.json|privacy_data_flow_inventory.json,Cannot downgrade raw event or debug exposure risk without runtime evidence of masking and disclosure fences.,ROLE_GOVERNANCE_RELEASE_APPROVER,,blueprint/phase-2-identity-and-echoes.md#Raw identity values are never emitted on the bus|data/analysis/runtime_topology_manifest.json#trust_zone_boundaries,Security review is required whenever telemetry or adapter boundaries change.
ROLE_GOVERNANCE_RELEASE_APPROVER,Governance and Release Approver,PRIV_REVIEW_RELEASE_CANDIDATE_AND_ACTUAL_UPGRADE,Owns the point where mock-now bounded risks can become accepted_pending_signoff or actual-production gated obligations.,release_and_governance_gate,mixed,privacy_control_traceability.json|126_mock_now_vs_actual_privacy_strategy.md|126_privacy_change_triggers_and_dpia_rerun_rules.md,"No release, onboarding, or actual-production promotion may rely on a self-authored privacy checklist alone.",ROLE_SERVICE_OWNER_OPERATIONS_REVIEWER,PREREQUISITE_GAP_125_CLINICAL_SIGNOFF_PACK_PENDING,blueprint/platform-runtime-and-release-blueprint.md#ReleaseApprovalFreeze|blueprint/phase-9-the-assurance-ledger.md#AssuranceSurfaceRuntimeBinding,This role closes neither controller assignment nor processor evidence gaps by assertion; those remain explicit backlog rows.
ROLE_SERVICE_OWNER_OPERATIONS_REVIEWER,Service Owner / Operations Reviewer,PRIV_REVIEW_INCIDENT_AND_BREAK_GLASS,"Checks support replay, incident, fallback review, and break-glass routes against real operational necessity.",operational_necessity_review,mixed,privacy_data_flow_inventory.json|privacy_control_traceability.json,Operational convenience cannot widen minimum-necessary ceilings or turn replay into ordinary read access.,ROLE_PRIVACY_LEAD_PLACEHOLDER,,"blueprint/phase-9-the-assurance-ledger.md#9C. Audit explorer, break-glass review, and support replay|data/analysis/break_glass_scope_rules.json#rules",This role owns practical break-glass burden and expiry evidence.
